"EMPRESA: Razón social (nombre de la empresa)","EMPRESA: RFC","EMPRESA: Folio mercantil","EMPRESA: Objeto social (descripción de actividades)","EMPRESA: Número de empleados","EMPRESA: Fecha de creación (dd/mm/aaaa)","EMPRESA: Capital social mínimo (con cuánto dinero se registró la empresa)","EMPRESA: Dirección fiscal","EMPRESA: Latitud y longitud (separadas por coma)","EMPRESA: Entidad Federativa (llena esta columna sólo si no tienes la dirección y/o la coordenada geográfica)","EMPRESA: Teléfono","EMPRESA: Web","EMPRESA: Correo electrónico","REP LEGAL: Nombre completo","REP LEGAL: RFC","REP LEGAL: Dirección","REP LEGAL: Latitud y longitud (separadas por coma)","REP LEGAL: Entidad Federativa (llena esta columna sólo si no tienes la dirección y/o la coordenada geográfica)","REP LEGAL: Nombre de la dependencia donde fue funcionario (si es que aplica)","REP LEGAL: Último año en activo de la dependencia donde fue funcionario (si es que aplica)","ACCIONISTAS: Nombre completo (separar nombres con punto y coma)",ACCIONISTAS:RFC,"ACCIONISTAS: Dirección","ACCIONISTAS: Latitud y longitud (separadas por coma)","ACCIONISTAS: Entidad Federativa (llena esta columna sólo si no tienes la dirección y/o la coordenada geográfica)","ACCIONISTAS: Nombre de la dependencia donde fue funcionario (si es que aplica)","ACCIONISTAS: Último año en activo de la dependencia donde fue funcionario (si es que aplica)","ACCIONISTAS: Capital aportado","ADMIN: Nombre completo","ADMIN: RFC","ADMIN: Dirección","ADMIN: Latitud y longitud (separadas por coma)","ADMIN: Entidad Federativa (llena esta columna sólo si no tienes la dirección y/o la coordenada geográfica)","ADMIN: Nombre de la dependencia donde fue funcionario (si es que aplica)","ADMIN: Último año en activo de la dependencia donde fue funcionario (si es que aplica)","COMIS / CONSE: Nombre completo","COMIS / CONSE: RFC","COMIS / CONSE: Dirección","COMIS / CONSE: Latitud y longitud (separadas por coma)","COMIS / CONSE: Entidad Federativa (llena esta columna sólo si no tienes la dirección y/o la coordenada geográfica)","COMIS / CONSE: Nombre de la dependencia donde fue funcionario (si es que aplica)","COMIS / CONSE: Último año en activo de la dependencia donde fue funcionario (si es que aplica)","NOTARIA: Nombre del notario que firma el acta","NOTARIA: Número de la notaría","NOTARIA: Dirección de la notaría","NOTARIA: Latitud y longitud (separadas por coma)","NOTARIA: Entidad Federativa (llena esta columna sólo si no tienes la dirección y/o la coordenada geográfica)","INFO OFICIAL: Estatus CompraNet (InscritoRUPC, NoInscritoRUPC, RegCompraNet)","INFO OFICIAL: Empresa fantasma o no localizada (SATdefinitiva, SATpresunta, SATdesvirtuada, SATfavorable, ASFnoLocalizada, SinAntReg)","CONTRATO: Empresa, dependencia o instancia que otorga los recursos","CONTRATO: Número de contrato","CONTRATO: Fecha de inicio de contrato","CONTRATO: Fecha de término de contrato","CONTRATO: Servicio/obra realizada","CONTRATO: Nombre de la persona que firma","CONTRATO: Cargo de la persona que firma","CONTRATO: Montos de contratos individuales","CONTRATO: Número de licitación ","CONTRATO: Fecha de fallo de la licitación","CONTRATO: Monto total de la licitación","CONVENIO: Dependencia o instancia que OTORGA los recursos","CONVENIO: Dependencia o instancia que RECIBE los recursos","CONVENIO: Número de convenio","CONVENIO: Fecha de inicio de convenio","CONVENIO: Fecha de término convenio","CONVENIO: Objeto del convenio","CONVENIO: Nombre de la persona que firma (de la dependencia o instancia que OTORGA los recursos)","CONVENIO: Cargo de la persona que firma (de la dependencia o instancia que OTORGA los recursos)","CONVENIO: Nombre de la persona que firma (de la dependencia o instancia que RECIBE los recursos)","CONVENIO: Cargo de la persona que firma (de la dependencia o instancia que RECIBE los recursos)","CONVENIO: Monto total del convenio","CONVENIO: Nombre del titular de la dependencia o instancia que otorga los recurso","CONVENIO: Nombre del titular de la dependencia o instancia que recibe los recurso","TRANSFERENCIA DEPENDENCIA O INSTANCIA: Dependencia o instancia que otorga los recursos","TRANSFERENCIA DEPENDENCIA O INSTANCIA: Monto de transferencias individuales","TRANSFERENCIA DEPENDENCIA O INSTANCIA: Número de convenio relacionado a esta transferencia","TRANSFERENCIAS A ESTA EMPRESA: Empresa que otorga los recursos","TRANSFERENCIAS A ESTA EMPRESA: Monto de transferencias individuales","TRANSFERENCIAS DE ESTA EMPRESA: Empresa a la que le transfirió esta empresa","TRANSFERENCIAS DE ESTA EMPRESA: Monto de transferencias individuales","OTRO: Otras empresas relacionadas a esta empresa (separar con punto y coma)","OTRO: Otras personas relacionadas a esta empresa (separar con punto y coma)","OTRO: Otros domicilios relacionados a esta empresa (separar con punto y coma)","OTRO: Otros RFC relacionados a esta empresa (separar con punto y coma)","OTRO: Otras fechas relacionadas a esta empresa (separar con punto y coma)","OTRO: Otros correos electrónicos relacionados a esta empresa (separar con punto y coma)","OTRO: Otros sitios web relacionados a esta empresa (separar con punto y coma)","OTRO: Otros teléfonos relacionados a esta empresa (separar con punto y coma)","OTRO: Otros números de contratos o convenios relacionados a esta empresa (separar con punto y coma)","OTRO: Otras dependencias o instancias relacionadas a esta empresa (separar con punto y coma","OTRO: Montos recibidos","OTRO: Titulares de instancias de montos recibidos","OTRO: Montos otorgados","NUEVO: Nombre de la categoría (separar con punto y coma)","NUEVO: Contenido (separar con punto y coma)","OTRO: Comentarios adicionales (formato de escritura: libre)"
"APSELP AGENTE DE SEGUROS Y DE FIANZAS SA DE CV",AAS110211FM5,,,,,,,,,,,,,,,,,,,,,,,,,,,,,,,,,,,,,,,,,,,,,,,,,1293116,,,,,,38800,,,,,,,,,,,,,,,,,,,,,,,,,,,,,,,,,,,,,,,
"APSELP AGENTE DE SEGUROS Y DE FIANZAS SA DE CV",AAS110211FM5,,,,,,,,,,,,,,,,,,,,,,,,,,,,,,,,,,,,,,,,,,,,,,,,,1682808,,,,,,203700,,,,,,,,,,,,,,,,,,,,,,,,,,,,,,,,,,,,,,,
"PROCESADORA Y DISTRIBUIDORA LOS CHANEQUES SA DE CV",PDC110704EI1,,,,,,,,,,,,,,,,,,,,,,,,,,,,,,,,,,,,,,,,,,,,,,,,,1621717,,,,,,2307591,,,,,,,,,,,,,,,,,,,,,,,,,,,,,,,,,,,,,,,
"PROCESADORA Y DISTRIBUIDORA LOS CHANEQUES SA DE CV",PDC110704EI1,,,,,,,,,,,,,,,,,,,,,,,,,,,,,,,,,,,,,,,,,,,,,,,,,1313426,,,,,,156920,,,,,,,,,,,,,,,,,,,,,,,,,,,,,,,,,,,,,,,
"GEYCON  GERENCIAS Y CONSTRUCCION SA DE CV",GGY120216MM0,,,,,,,,,,,,,,,,,,,,,,,,,,,,,,,,,,,,,,,,,,,,,,,,,1709880,,,,,,7298453,,,,,,,,,,,,,,,,,,,,,,,,,,,,,,,,,,,,,,,
"TOKA INTERNACIONAL S A P I DE CV",TIN090211JC9,,,,,,,,,,,,,,,,,,,,,,,,,,,,,,,,,,,,,,,,,,,,,,,,,1664275,,,,,,81859,,,,,,,,,,,,,,,,,,,,,,,,,,,,,,,,,,,,,,,
"TOKA INTERNACIONAL S A P I DE CV",TIN090211JC9,,,,,,,,,,,,,,,,,,,,,,,,,,,,,,,,,,,,,,,,,,,,,,,,,1664275,,,,,,16371,,,,,,,,,,,,,,,,,,,,,,,,,,,,,,,,,,,,,,,
"TOKA INTERNACIONAL S A P I DE CV",TIN090211JC9,,,,,,,,,,,,,,,,,,,,,,,,,,,,,,,,,,,,,,,,,,,,,,,,,1825016,,,,,,1982320,,,,,,,,,,,,,,,,,,,,,,,,,,,,,,,,,,,,,,,
"PROFESIONALES EN MANTENIMIENTO Y LIMPIEZA SA DE CV",PML9912018L9,,,,,,,,,,,,,,,,,,,,,,,,,,,,,,,,,,,,,,,,,,,,,,,,,1292997,,,,,,290472,,,,,,,,,,,,,,,,,,,,,,,,,,,,,,,,,,,,,,,
"CONSTRUCCION ASESORIA Y DISE&O SA DE CV",CAD960221P7A,,,,,,,,,,,,,,,,,,,,,,,,,,,,,,,,,,,,,,,,,,,,,,,,,1709922,,,,,,13551594,,,,,,,,,,,,,,,,,,,,,,,,,,,,,,,,,,,,,,,
"PROFESIONALES EN MANTENIMIENTO Y LIMPIEZA SA DE CV",PML9912018L9,,,,,,,,,,,,,,,,,,,,,,,,,,,,,,,,,,,,,,,,,,,,,,,,,1611833,,,,,,1736000,,,,,,,,,,,,,,,,,,,,,,,,,,,,,,,,,,,,,,,
"GRAFICOS DIGITALES AVANZADOS SA DE CV",GDA040126AT0,,,,,,,,,,,,,,,,,,,,,,,,,,,,,,,,,,,,,,,,,,,,,,,,,1714525,,,,,,33600,,,,,,,,,,,,,,,,,,,,,,,,,,,,,,,,,,,,,,,
"GRAFICOS DIGITALES AVANZADOS SA DE CV",GDA040126AT0,,,,,,,,,,,,,,,,,,,,,,,,,,,,,,,,,,,,,,,,,,,,,,,,,1681314,,,,,,97975,,,,,,,,,,,,,,,,,,,,,,,,,,,,,,,,,,,,,,,
"TOKA INTERNACIONAL S A P I DE CV",TIN090211JC9,,,,,,,,,,,,,,,,,,,,,,,,,,,,,,,,,,,,,,,,,,,,,,,,,1777158,,,,,,27513,,,,,,,,,,,,,,,,,,,,,,,,,,,,,,,,,,,,,,,
"TECNOLOGIA Y CONSTRUCCIONES AR-PE SA DE CV",TCA070323N21,,,,,,,,,,,,,,,,,,,,,,,,,,,,,,,,,,,,,,,,,,,,,,,,,1633799,,,,,,33806,,,,,,,,,,,,,,,,,,,,,,,,,,,,,,,,,,,,,,,
"JARD CORPORATIVO",JCO980622EV1,,,,,,,,,,,,,,,,,,,,,,,,,,,,,,,,,,,,,,,,,,,,,,,,,1744393,,,,,,327250,,,,,,,,,,,,,,,,,,,,,,,,,,,,,,,,,,,,,,,
"TOKA INTERNACIONAL S A P I DE CV",TIN090211JC9,,,,,,,,,,,,,,,,,,,,,,,,,,,,,,,,,,,,,,,,,,,,,,,,,1618409,,,,,,53588,,,,,,,,,,,,,,,,,,,,,,,,,,,,,,,,,,,,,,,
"GRUPO CONSTRUCTOR DOLMEN SA DE CV",GCD910729JC6,,,,,,,,,,,,,,,,,,,,,,,,,,,,,,,,,,,,,,,,,,,,,,,,,1715681,,,,,,13555256,,,,,,,,,,,,,,,,,,,,,,,,,,,,,,,,,,,,,,,
"TEC PLUSS SA DE CV",TPL030219RE3,,,,,,,,,,,,,,,,,,,,,,,,,,,,,,,,,,,,,,,,,,,,,,,,,975480,,,,,,470780,,,,,,,,,,,,,,,,,,,,,,,,,,,,,,,,,,,,,,,
"TEC PLUSS SA DE CV",TPL030219RE3,,,,,,,,,,,,,,,,,,,,,,,,,,,,,,,,,,,,,,,,,,,,,,,,,975480,,,,,,470780,,,,,,,,,,,,,,,,,,,,,,,,,,,,,,,,,,,,,,,
"TEC PLUSS SA DE CV",TPL030219RE3,,,,,,,,,,,,,,,,,,,,,,,,,,,,,,,,,,,,,,,,,,,,,,,,,975480,,,,,,172413,,,,,,,,,,,,,,,,,,,,,,,,,,,,,,,,,,,,,,,
"TEC PLUSS SA DE CV",TPL030219RE3,,,,,,,,,,,,,,,,,,,,,,,,,,,,,,,,,,,,,,,,,,,,,,,,,1742620,,,,,,19454472,,,,,,,,,,,,,,,,,,,,,,,,,,,,,,,,,,,,,,,
"DESARROLLO INMOBILIARIO GERJAU SA DE CV",DIG100820M64,,,,,,,,,,,,,,,,,,,,,,,,,,,,,,,,,,,,,,,,,,,,,,,,,1716433,,,,,,10415836,,,,,,,,,,,,,,,,,,,,,,,,,,,,,,,,,,,,,,,
"EVENTOS SIN LIMITACIONES SA DE CV",ESL120525E63,,,,,,,,,,,,,,,,,,,,,,,,,,,,,,,,,,,,,,,,,,,,,,,,,1644741,,,,,,178000,,,,,,,,,,,,,,,,,,,,,,,,,,,,,,,,,,,,,,,
"DRILLING AND STRUCTURAL ANCHORS SA DE CV",DSA140227FX5,,,,,,,,,,,,,,,,,,,,,,,,,,,,,,,,,,,,,,,,,,,,,,,,,1716404,,,,,,4553194,,,,,,,,,,,,,,,,,,,,,,,,,,,,,,,,,,,,,,,
"ORACLE DE MEXICO S.A. de C.V.",OME910101TA3,,,,,,,,,,,,,,,,,,,,,,,,,,,,,,,,,,,,,,,,,,,,,,,,,1774029,,,,,,67641,,,,,,,,,,,,,,,,,,,,,,,,,,,,,,,,,,,,,,,
"MUEBLES Y MUDANZAS BENITEZ SA DE CV",MMB7808302J0,,,,,,,,,,,,,,,,,,,,,,,,,,,,,,,,,,,,,,,,,,,,,,,,,1740033,,,,,,760815,,,,,,,,,,,,,,,,,,,,,,,,,,,,,,,,,,,,,,,
"ADMINISTRACION Y CULTURA S DE RL DE CV",ACU1509281I5,,,,,,,,,,,,,,,,,,,,,,,,,,,,,,,,,,,,,,,,,,,,,,,,,1806249,,,,,,160042,,,,,,,,,,,,,,,,,,,,,,,,,,,,,,,,,,,,,,,
"GRUPO SIAYEC SA DE CV",GSI9211132TA,,,,,,,,,,,,,,,,,,,,,,,,,,,,,,,,,,,,,,,,,,,,,,,,,1744439,,,,,,4174575,,,,,,,,,,,,,,,,,,,,,,,,,,,,,,,,,,,,,,,
"IMPRESO POLIS SA DE CV",IPO150724TY8,,,,,,,,,,,,,,,,,,,,,,,,,,,,,,,,,,,,,,,,,,,,,,,,,1777100,,,,,,29999,,,,,,,,,,,,,,,,,,,,,,,,,,,,,,,,,,,,,,,
"PRIETO RUIZ DE VELASCO Y COMPAÑIA SC",PRV430101MB5,,,,,,,,,,,,,,,,,,,,,,,,,,,,,,,,,,,,,,,,,,,,,,,,,1681031,,,,,,186278,,,,,,,,,,,,,,,,,,,,,,,,,,,,,,,,,,,,,,,
"SILVIANO GIL DIAZ",,,,,,,,,,,,,,,,,,,,,,,,,,,,,,,,,,,,,,,,,,,,,,,,,,1712296,,,,,,215000,,,,,,,,,,,,,,,,,,,,,,,,,,,,,,,,,,,,,,,
"PRIETO RUIZ DE VELASCO Y COMPAÑIA SC",PRV430101MB5,,,,,,,,,,,,,,,,,,,,,,,,,,,,,,,,,,,,,,,,,,,,,,,,,1665826,,,,,,1050000,,,,,,,,,,,,,,,,,,,,,,,,,,,,,,,,,,,,,,,
"GRUPO SIAYEC SA DE CV",GSI9211132TA,,,,,,,,,,,,,,,,,,,,,,,,,,,,,,,,,,,,,,,,,,,,,,,,,1716043,,,,,,509650,,,,,,,,,,,,,,,,,,,,,,,,,,,,,,,,,,,,,,,
"CASANOVA VALLEJO SA DE CV",CVA910402GI5,,,,,,,,,,,,,,,,,,,,,,,,,,,,,,,,,,,,,,,,,,,,,,,,,1622174,,,,,,122064,,,,,,,,,,,,,,,,,,,,,,,,,,,,,,,,,,,,,,,
"JARDINERIA 2000 SA",JDM850910UD2,,,,,,,,,,,,,,,,,,,,,,,,,,,,,,,,,,,,,,,,,,,,,,,,,1302018,,,,,,73097,,,,,,,,,,,,,,,,,,,,,,,,,,,,,,,,,,,,,,,
"GRUPO MEXICANO DE SEGUROS SA DE CV",GMS971110BTA,,,,,,,,,,,,,,,,,,,,,,,,,,,,,,,,,,,,,,,,,,,,,,,,,1285224,,,,,,15733,,,,,,,,,,,,,,,,,,,,,,,,,,,,,,,,,,,,,,,
"ANACRISIS AGENCIA EDITORIAL, S.A. DE C.V.",,,,,,,,,,,,,,,,,,,,,,,,,,,,,,,,,,,,,,,,,,,,,,,,,,1775183,,,,,,33000,,,,,,,,,,,,,,,,,,,,,,,,,,,,,,,,,,,,,,,
"JARDINERIA 2000 SA",JDM850910UD2,,,,,,,,,,,,,,,,,,,,,,,,,,,,,,,,,,,,,,,,,,,,,,,,,1628166,,,,,,401223,,,,,,,,,,,,,,,,,,,,,,,,,,,,,,,,,,,,,,,
"GRUPO MEXICANO DE SEGUROS SA DE CV",GMS971110BTA,,,,,,,,,,,,,,,,,,,,,,,,,,,,,,,,,,,,,,,,,,,,,,,,,1633896,,,,,,81600,,,,,,,,,,,,,,,,,,,,,,,,,,,,,,,,,,,,,,,
"GRUPO MEXICANO DE SEGUROS SA DE CV",GMS971110BTA,,,,,,,,,,,,,,,,,,,,,,,,,,,,,,,,,,,,,,,,,,,,,,,,,1269806,,,,,,716236,,,,,,,,,,,,,,,,,,,,,,,,,,,,,,,,,,,,,,,
"GRUPO MEXICANO DE SEGUROS SA DE CV",GMS971110BTA,,,,,,,,,,,,,,,,,,,,,,,,,,,,,,,,,,,,,,,,,,,,,,,,,1603764,,,,,,4182417,,,,,,,,,,,,,,,,,,,,,,,,,,,,,,,,,,,,,,,
"CARLOS GOMEZ VARGAS",,,,,,,,,,,,,,,,,,,,,,,,,,,,,,,,,,,,,,,,,,,,,,,,,,1664453,,,,,,34183,,,,,,,,,,,,,,,,,,,,,,,,,,,,,,,,,,,,,,,
"DOC SOLUTIONS DE MEXICO SA DE CV",DSM011108AR5,,,,,,,,,,,,,,,,,,,,,,,,,,,,,,,,,,,,,,,,,,,,,,,,,1741936,,,,,,2825000,,,,,,,,,,,,,,,,,,,,,,,,,,,,,,,,,,,,,,,
"DOC SOLUTIONS DE MEXICO SA DE CV",DSM011108AR5,,,,,,,,,,,,,,,,,,,,,,,,,,,,,,,,,,,,,,,,,,,,,,,,,1741955,,,,,,2825000,,,,,,,,,,,,,,,,,,,,,,,,,,,,,,,,,,,,,,,
"CONSORCIO BASALTO INGENIEROS & ARQUITECTOS SA DE CV",CBI120305RV7,,,,,,,,,,,,,,,,,,,,,,,,,,,,,,,,,,,,,,,,,,,,,,,,,1724618,,,,,,6950965,,,,,,,,,,,,,,,,,,,,,,,,,,,,,,,,,,,,,,,
ELECTROPURA,ELE9012281G2,,,,,,,,,,,,,,,,,,,,,,,,,,,,,,,,,,,,,,,,,,,,,,,,,1642405,,,,,,89994,,,,,,,,,,,,,,,,,,,,,,,,,,,,,,,,,,,,,,,
"OMNIUS SOLUCIONES EN TECNOLOGIA SA DE CV",OST111202AV2,,,,,,,,,,,,,,,,,,,,,,,,,,,,,,,,,,,,,,,,,,,,,,,,,1714480,,,,,,81000,,,,,,,,,,,,,,,,,,,,,,,,,,,,,,,,,,,,,,,
"IT SERVICES AND SOLUTIONS",ISS0203181N4,,,,,,,,,,,,,,,,,,,,,,,,,,,,,,,,,,,,,,,,,,,,,,,,,1744373,,,,,,301724,,,,,,,,,,,,,,,,,,,,,,,,,,,,,,,,,,,,,,,
"ARTICULOS BASICOS DE CALIDAD EN UNIFORMES Y EQUIPOS SA DE CV",ABC1012107T1,,,,,,,,,,,,,,,,,,,,,,,,,,,,,,,,,,,,,,,,,,,,,,,,,1769928,,,,,,90917,,,,,,,,,,,,,,,,,,,,,,,,,,,,,,,,,,,,,,,
"IMPORTADORA ASSECH SA DE CV",IAS0902137V4,,,,,,,,,,,,,,,,,,,,,,,,,,,,,,,,,,,,,,,,,,,,,,,,,1695962,,,,,,537000,,,,,,,,,,,,,,,,,,,,,,,,,,,,,,,,,,,,,,,
"IMPORTADORA ASSECH SA DE CV",IAS0902137V4,,,,,,,,,,,,,,,,,,,,,,,,,,,,,,,,,,,,,,,,,,,,,,,,,1695962,,,,,,107400,,,,,,,,,,,,,,,,,,,,,,,,,,,,,,,,,,,,,,,
"GRANJA DIDACTICA DON PEPE SC",GDD970526EU3,,,,,,,,,,,,,,,,,,,,,,,,,,,,,,,,,,,,,,,,,,,,,,,,,1763830,,,,,,129963,,,,,,,,,,,,,,,,,,,,,,,,,,,,,,,,,,,,,,,
"MARIA DEL CARMEN DEL SAGRADO CORAZON GUTIERREZ HACES",,,,,,,,,,,,,,,,,,,,,,,,,,,,,,,,,,,,,,,,,,,,,,,,,,1714290,,,,,,90100,,,,,,,,,,,,,,,,,,,,,,,,,,,,,,,,,,,,,,,
"SIME SOLUCIONES INTEGRALES EN MANTENIMIENTO E INGENIERIA ELECTROMECANICA SA DE CV",SSI051207E14,,,,,,,,,,,,,,,,,,,,,,,,,,,,,,,,,,,,,,,,,,,,,,,,,1646532,,,,,,38500,,,,,,,,,,,,,,,,,,,,,,,,,,,,,,,,,,,,,,,
"GIBAC SUMINISTROS INFORMATICOS Y COMUNICACIONES SA DE CV",GSI090526IW2,,,,,,,,,,,,,,,,,,,,,,,,,,,,,,,,,,,,,,,,,,,,,,,,,1727225,,,,,,431888,,,,,,,,,,,,,,,,,,,,,,,,,,,,,,,,,,,,,,,
"EXPERT UPS, S.A. DE C.V.",,,,,,,,,,,,,,,,,,,,,,,,,,,,,,,,,,,,,,,,,,,,,,,,,,1763901,,,,,,215000,,,,,,,,,,,,,,,,,,,,,,,,,,,,,,,,,,,,,,,
"CONSTRUCCIONES M R M",CMR890228V27,,,,,,,,,,,,,,,,,,,,,,,,,,,,,,,,,,,,,,,,,,,,,,,,,1715677,,,,,,3987445,,,,,,,,,,,,,,,,,,,,,,,,,,,,,,,,,,,,,,,
"RIZOMA ARQUITECTURA E INGENIERA SA DE CV",RAI160205F7A,,,,,,,,,,,,,,,,,,,,,,,,,,,,,,,,,,,,,,,,,,,,,,,,,1736285,,,,,,7498146,,,,,,,,,,,,,,,,,,,,,,,,,,,,,,,,,,,,,,,
"SEGUROS BANORTE SA DE CV, GRUPO FINANCIERO BANORTE",SBG971124PL2,,,,,,,,,,,,,,,,,,,,,,,,,,,,,,,,,,,,,,,,,,,,,,,,,1775206,,,,,,44403,,,,,,,,,,,,,,,,,,,,,,,,,,,,,,,,,,,,,,,
"GARHEC CONSTRUCCIONES SA DE CV",GCO120423SF0,,,,,,,,,,,,,,,,,,,,,,,,,,,,,,,,,,,,,,,,,,,,,,,,,1633861,,,,,,73659,,,,,,,,,,,,,,,,,,,,,,,,,,,,,,,,,,,,,,,
"ONACON SA DE CV",ONA890406I57,,,,,,,,,,,,,,,,,,,,,,,,,,,,,,,,,,,,,,,,,,,,,,,,,1715233,,,,,,12399517,,,,,,,,,,,,,,,,,,,,,,,,,,,,,,,,,,,,,,,
"OSCAR JIMENEZ CRUCES",,,,,,,,,,,,,,,,,,,,,,,,,,,,,,,,,,,,,,,,,,,,,,,,,,1681372,,,,,,57460,,,,,,,,,,,,,,,,,,,,,,,,,,,,,,,,,,,,,,,
"SIME SOLUCIONES INTEGRALES EN MANTENIMIENTO E INGENIERIA ELECTROMECANICA SA DE CV",SSI051207E14,,,,,,,,,,,,,,,,,,,,,,,,,,,,,,,,,,,,,,,,,,,,,,,,,1646142,,,,,,68500,,,,,,,,,,,,,,,,,,,,,,,,,,,,,,,,,,,,,,,
"GARHEC CONSTRUCCIONES SA DE CV",GCO120423SF0,,,,,,,,,,,,,,,,,,,,,,,,,,,,,,,,,,,,,,,,,,,,,,,,,1730848,,,,,,3907795,,,,,,,,,,,,,,,,,,,,,,,,,,,,,,,,,,,,,,,
