"EMPRESA: Razón social (nombre de la empresa)","EMPRESA: RFC","EMPRESA: Folio mercantil","EMPRESA: Objeto social (descripción de actividades)","EMPRESA: Número de empleados","EMPRESA: Fecha de creación (dd/mm/aaaa)","EMPRESA: Capital social mínimo (con cuánto dinero se registró la empresa)","EMPRESA: Dirección fiscal","EMPRESA: Latitud y longitud (separadas por coma)","EMPRESA: Entidad Federativa (llena esta columna sólo si no tienes la dirección y/o la coordenada geográfica)","EMPRESA: Teléfono","EMPRESA: Web","EMPRESA: Correo electrónico","REP LEGAL: Nombre completo","REP LEGAL: RFC","REP LEGAL: Dirección","REP LEGAL: Latitud y longitud (separadas por coma)","REP LEGAL: Entidad Federativa (llena esta columna sólo si no tienes la dirección y/o la coordenada geográfica)","REP LEGAL: Nombre de la dependencia donde fue funcionario (si es que aplica)","REP LEGAL: Último año en activo de la dependencia donde fue funcionario (si es que aplica)","ACCIONISTAS: Nombre completo (separar nombres con punto y coma)",ACCIONISTAS:RFC,"ACCIONISTAS: Dirección","ACCIONISTAS: Latitud y longitud (separadas por coma)","ACCIONISTAS: Entidad Federativa (llena esta columna sólo si no tienes la dirección y/o la coordenada geográfica)","ACCIONISTAS: Nombre de la dependencia donde fue funcionario (si es que aplica)","ACCIONISTAS: Último año en activo de la dependencia donde fue funcionario (si es que aplica)","ACCIONISTAS: Capital aportado","ADMIN: Nombre completo","ADMIN: RFC","ADMIN: Dirección","ADMIN: Latitud y longitud (separadas por coma)","ADMIN: Entidad Federativa (llena esta columna sólo si no tienes la dirección y/o la coordenada geográfica)","ADMIN: Nombre de la dependencia donde fue funcionario (si es que aplica)","ADMIN: Último año en activo de la dependencia donde fue funcionario (si es que aplica)","COMIS / CONSE: Nombre completo","COMIS / CONSE: RFC","COMIS / CONSE: Dirección","COMIS / CONSE: Latitud y longitud (separadas por coma)","COMIS / CONSE: Entidad Federativa (llena esta columna sólo si no tienes la dirección y/o la coordenada geográfica)","COMIS / CONSE: Nombre de la dependencia donde fue funcionario (si es que aplica)","COMIS / CONSE: Último año en activo de la dependencia donde fue funcionario (si es que aplica)","NOTARIA: Nombre del notario que firma el acta","NOTARIA: Número de la notaría","NOTARIA: Dirección de la notaría","NOTARIA: Latitud y longitud (separadas por coma)","NOTARIA: Entidad Federativa (llena esta columna sólo si no tienes la dirección y/o la coordenada geográfica)","INFO OFICIAL: Estatus CompraNet (InscritoRUPC, NoInscritoRUPC, RegCompraNet)","INFO OFICIAL: Empresa fantasma o no localizada (SATdefinitiva, SATpresunta, SATdesvirtuada, SATfavorable, ASFnoLocalizada, SinAntReg)","CONTRATO: Empresa, dependencia o instancia que otorga los recursos","CONTRATO: Número de contrato","CONTRATO: Fecha de inicio de contrato","CONTRATO: Fecha de término de contrato","CONTRATO: Servicio/obra realizada","CONTRATO: Nombre de la persona que firma","CONTRATO: Cargo de la persona que firma","CONTRATO: Montos de contratos individuales","CONTRATO: Número de licitación ","CONTRATO: Fecha de fallo de la licitación","CONTRATO: Monto total de la licitación","CONVENIO: Dependencia o instancia que OTORGA los recursos","CONVENIO: Dependencia o instancia que RECIBE los recursos","CONVENIO: Número de convenio","CONVENIO: Fecha de inicio de convenio","CONVENIO: Fecha de término convenio","CONVENIO: Objeto del convenio","CONVENIO: Nombre de la persona que firma (de la dependencia o instancia que OTORGA los recursos)","CONVENIO: Cargo de la persona que firma (de la dependencia o instancia que OTORGA los recursos)","CONVENIO: Nombre de la persona que firma (de la dependencia o instancia que RECIBE los recursos)","CONVENIO: Cargo de la persona que firma (de la dependencia o instancia que RECIBE los recursos)","CONVENIO: Monto total del convenio","CONVENIO: Nombre del titular de la dependencia o instancia que otorga los recurso","CONVENIO: Nombre del titular de la dependencia o instancia que recibe los recurso","TRANSFERENCIA DEPENDENCIA O INSTANCIA: Dependencia o instancia que otorga los recursos","TRANSFERENCIA DEPENDENCIA O INSTANCIA: Monto de transferencias individuales","TRANSFERENCIA DEPENDENCIA O INSTANCIA: Número de convenio relacionado a esta transferencia","TRANSFERENCIAS A ESTA EMPRESA: Empresa que otorga los recursos","TRANSFERENCIAS A ESTA EMPRESA: Monto de transferencias individuales","TRANSFERENCIAS DE ESTA EMPRESA: Empresa a la que le transfirió esta empresa","TRANSFERENCIAS DE ESTA EMPRESA: Monto de transferencias individuales","OTRO: Otras empresas relacionadas a esta empresa (separar con punto y coma)","OTRO: Otras personas relacionadas a esta empresa (separar con punto y coma)","OTRO: Otros domicilios relacionados a esta empresa (separar con punto y coma)","OTRO: Otros RFC relacionados a esta empresa (separar con punto y coma)","OTRO: Otras fechas relacionadas a esta empresa (separar con punto y coma)","OTRO: Otros correos electrónicos relacionados a esta empresa (separar con punto y coma)","OTRO: Otros sitios web relacionados a esta empresa (separar con punto y coma)","OTRO: Otros teléfonos relacionados a esta empresa (separar con punto y coma)","OTRO: Otros números de contratos o convenios relacionados a esta empresa (separar con punto y coma)","OTRO: Otras dependencias o instancias relacionadas a esta empresa (separar con punto y coma","OTRO: Montos recibidos","OTRO: Titulares de instancias de montos recibidos","OTRO: Montos otorgados","NUEVO: Nombre de la categoría (separar con punto y coma)","NUEVO: Contenido (separar con punto y coma)","OTRO: Comentarios adicionales (formato de escritura: libre)"
"EDIFICADORA DOPERZ, S.A. DE C.V.",,,,,,,,,,,,,,,,,,,,,,,,,,,,,,,,,,,,,,,,,,,,,,,,,,,,,,,,853448,,,,,,,,,,,,,,,,,,,,,,,,,,,,,,,,,,,,,,,
"COMERCIALIZADORA Y CONSTRUCTORA NITA, S.A. DE C.V.",,,,,,,,,,,,,,,,,,,,,,,,,,,,,,,,,,,,,,,,,,,,,,,,,,,,,,,,9003879,,,,,,,,,,,,,,,,,,,,,,,,,,,,,,,,,,,,,,,
"SERVICIO Y COMBUSTIBLE NORORIENTAL, S.R.L. DE C.V.",,,,,,,,,,,,,,,,,,,,,,,,,,,,,,,,,,,,,,,,,,,,,,,,,,,,,,,,6888574,,,,,,,,,,,,,,,,,,,,,,,,,,,,,,,,,,,,,,,
"TONANTZI MEX, S.A. DE C.V.",TME071123CJ9,,,,,,,,,,,,,,,,,,,,,,,,,,,,,,,,,,,,,,,,,,,,,,,,,,,,,,,3559798,,,,,,,,,,,,,,,,,,,,,,,,,,,,,,,,,,,,,,,
"COMERCIALIZADORA EMPRESARIAL GORUCA SA DE CV",CEG110818KV1,,,,,,,,,,,,,,,,,,,,,,,,,,,,,,,,,,,,,,,,,,,,,,,,,,,,,,,3658869,,,,,,,,,,,,,,,,,,,,,,,,,,,,,,,,,,,,,,,
"""GRUPO R&M CONSTRUCCIONES"" SA DE CV",GRC091221SG6,,,,,,,,,,,,,,,,,,,,,,,,,,,,,,,,,,,,,,,,,,,,,,,,,,,,,,,2899373,,,,,,,,,,,,,,,,,,,,,,,,,,,,,,,,,,,,,,,
"ARRENDADORA DE EQUIPOS OPERATIVOS SA DE CV",AEO990203669,,,,,,,,,,,,,,,,,,,,,,,,,,,,,,,,,,,,,,,,,,,,,,,,,,,,,,,9303982,,,,,,,,,,,,,,,,,,,,,,,,,,,,,,,,,,,,,,,
"ARRENDADORA DE EQUIPOS OPERATIVOS SA DE CV",AEO990203669,,,,,,,,,,,,,,,,,,,,,,,,,,,,,,,,,,,,,,,,,,,,,,,,,,,,,,,2498799,,,,,,,,,,,,,,,,,,,,,,,,,,,,,,,,,,,,,,,
"""GRUPO R&M CONSTRUCCIONES"" SA DE CV",GRC091221SG6,,,,,,,,,,,,,,,,,,,,,,,,,,,,,,,,,,,,,,,,,,,,,,,,,,,,,,,11533504,,,,,,,,,,,,,,,,,,,,,,,,,,,,,,,,,,,,,,,
"OUTSOURCING DE OBRAS Y PROYECTOS SA DE CV",OOP1106275B8,,,,,,,,,,,,,,,,,,,,,,,,,,,,,,,,,,,,,,,,,,,,,,,,,,,,,,,9557523,,,,,,,,,,,,,,,,,,,,,,,,,,,,,,,,,,,,,,,
"DISEÑO MODERNO EN CRISTAL SA DE CV",DMC1503255Z5,,,,,,,,,,,,,,,,,,,,,,,,,,,,,,,,,,,,,,,,,,,,,,,,,,,,,,,4225074,,,,,,,,,,,,,,,,,,,,,,,,,,,,,,,,,,,,,,,
"GRUPO CONSTRUCTOR SAN SALVADOR SA DE CV",GCS990628471,,,,,,,,,,,,,,,,,,,,,,,,,,,,,,,,,,,,,,,,,,,,,,,,,,,,,,,3738995,,,,,,,,,,,,,,,,,,,,,,,,,,,,,,,,,,,,,,,
"ALPE CONSTRUCCION Y ELECTRIFICACION SA DE CV",ACE1406182S5,,,,,,,,,,,,,,,,,,,,,,,,,,,,,,,,,,,,,,,,,,,,,,,,,,,,,,,4813235,,,,,,,,,,,,,,,,,,,,,,,,,,,,,,,,,,,,,,,
"HEKA CODESA SA DE CV",CUD100726KB2,,,,,,,,,,,,,,,,,,,,,,,,,,,,,,,,,,,,,,,,,,,,,,,,,,,,,,,1395183,,,,,,,,,,,,,,,,,,,,,,,,,,,,,,,,,,,,,,,
"GRUPO CONSTRUCTOR SAN SALVADOR SA DE CV",GCS990628471,,,,,,,,,,,,,,,,,,,,,,,,,,,,,,,,,,,,,,,,,,,,,,,,,,,,,,,11542744,,,,,,,,,,,,,,,,,,,,,,,,,,,,,,,,,,,,,,,
"UNIVERSAL COPIERS SA DE CV",UCO9912138Y0,,,,,,,,,,,,,,,,,,,,,,,,,,,,,,,,,,,,,,,,,,,,,,,,,,,,,,,297000,,,,,,,,,,,,,,,,,,,,,,,,,,,,,,,,,,,,,,,
"NC TECH, S.A. DE C.V.",,,,,,,,,,,,,,,,,,,,,,,,,,,,,,,,,,,,,,,,,,,,,,,,,,,,,,,,170689,,,,,,,,,,,,,,,,,,,,,,,,,,,,,,,,,,,,,,,
"OCTAVIO MASIEL RIVERA SALGADO",,,,,,,,,,,,,,,,,,,,,,,,,,,,,,,,,,,,,,,,,,,,,,,,,,,,,,,,37131,,,,,,,,,,,,,,,,,,,,,,,,,,,,,,,,,,,,,,,
"VIALIDADES ASFALTICAS Y DE CONCRETOS SA DE CV",VAC031030C6A,,,,,,,,,,,,,,,,,,,,,,,,,,,,,,,,,,,,,,,,,,,,,,,,,,,,,,,1292898,,,,,,,,,,,,,,,,,,,,,,,,,,,,,,,,,,,,,,,
"INTERMEDIACIÓN Y COMERCIALIZACIÓN DE MUEBLES TUBULARES, S.A. DE C.V.",,,,,,,,,,,,,,,,,,,,,,,,,,,,,,,,,,,,,,,,,,,,,,,,,,,,,,,,576073,,,,,,,,,,,,,,,,,,,,,,,,,,,,,,,,,,,,,,,
"DANIRA ALIN SALAZAR CONTRERAS",,,,,,,,,,,,,,,,,,,,,,,,,,,,,,,,,,,,,,,,,,,,,,,,,,,,,,,,50000,,,,,,,,,,,,,,,,,,,,,,,,,,,,,,,,,,,,,,,
"MIRANDA, ARANA VELAZCO S.C",,,,,,,,,,,,,,,,,,,,,,,,,,,,,,,,,,,,,,,,,,,,,,,,,,,,,,,,1995300,,,,,,,,,,,,,,,,,,,,,,,,,,,,,,,,,,,,,,,
"DANIRA ALIN SALAZAR CONTRERAS",,,,,,,,,,,,,,,,,,,,,,,,,,,,,,,,,,,,,,,,,,,,,,,,,,,,,,,,100000,,,,,,,,,,,,,,,,,,,,,,,,,,,,,,,,,,,,,,,
"LEYDA SALOME PEREZ BOBADILLA",,,,,,,,,,,,,,,,,,,,,,,,,,,,,,,,,,,,,,,,,,,,,,,,,,,,,,,,271875,,,,,,,,,,,,,,,,,,,,,,,,,,,,,,,,,,,,,,,
"JUAN CARLOS ORTEGA SIERRA",,,,,,,,,,,,,,,,,,,,,,,,,,,,,,,,,,,,,,,,,,,,,,,,,,,,,,,,43103,,,,,,,,,,,,,,,,,,,,,,,,,,,,,,,,,,,,,,,
"PERIFERICOS Y COMPONENTES INTEGRADOS SA DE CV",PCI980608N34,,,,,,,,,,,,,,,,,,,,,,,,,,,,,,,,,,,,,,,,,,,,,,,,,,,,,,,935626,,,,,,,,,,,,,,,,,,,,,,,,,,,,,,,,,,,,,,,
"EQUIPO DE SEGURIDAD Y ACCESORIOS SA DE CV",ESA091022JU9,,,,,,,,,,,,,,,,,,,,,,,,,,,,,,,,,,,,,,,,,,,,,,,,,,,,,,,3231034,,,,,,,,,,,,,,,,,,,,,,,,,,,,,,,,,,,,,,,
"SOLUCIONES EMPRESARIALES ORVES SA DE CV",SEO180309M20,,,,,,,,,,,,,,,,,,,,,,,,,,,,,,,,,,,,,,,,,,,,,,,,,,,,,,,1643520,,,,,,,,,,,,,,,,,,,,,,,,,,,,,,,,,,,,,,,
"FACTICOM S DE RL DE CV",FAC1511196K4,,,,,,,,,,,,,,,,,,,,,,,,,,,,,,,,,,,,,,,,,,,,,,,,,,,,,,,3243828,,,,,,,,,,,,,,,,,,,,,,,,,,,,,,,,,,,,,,,
"ABSPRO SA DE CV",ABS1110215N0,,,,,,,,,,,,,,,,,,,,,,,,,,,,,,,,,,,,,,,,,,,,,,,,,,,,,,,3325160,,,,,,,,,,,,,,,,,,,,,,,,,,,,,,,,,,,,,,,
"CENTRO DE ESTUDIOS ESTRATEGICOS Y DE GOBIERNO AC",CEE130705G21,,,,,,,,,,,,,,,,,,,,,,,,,,,,,,,,,,,,,,,,,,,,,,,,,,,,,,,1492662,,,,,,,,,,,,,,,,,,,,,,,,,,,,,,,,,,,,,,,
"DISTRIBUIDORA GENERAL DE MEXICO GE SA DE CV",DGM180406J85,,,,,,,,,,,,,,,,,,,,,,,,,,,,,,,,,,,,,,,,,,,,,,,,,,,,,,,170066,,,,,,,,,,,,,,,,,,,,,,,,,,,,,,,,,,,,,,,
"PAVIMENTOS Y CONCRETOS DE TOLUCA SA DE CV",PCT1411258F1,,,,,,,,,,,,,,,,,,,,,,,,,,,,,,,,,,,,,,,,,,,,,,,,,,,,,,,33199892,,,,,,,,,,,,,,,,,,,,,,,,,,,,,,,,,,,,,,,
"COMERCIALIZADORA TOLUMEX, S.A. DE C.V.",,,,,,,,,,,,,,,,,,,,,,,,,,,,,,,,,,,,,,,,,,,,,,,,,,,,,,,,516206,,,,,,,,,,,,,,,,,,,,,,,,,,,,,,,,,,,,,,,
"FABIOLA SUGEY CORREA HERNANDEZ",,,,,,,,,,,,,,,,,,,,,,,,,,,,,,,,,,,,,,,,,,,,,,,,,,,,,,,,532911,,,,,,,,,,,,,,,,,,,,,,,,,,,,,,,,,,,,,,,
"GNOW SOLUCIONES S DE RL DE CV",GSO170710UP8,,,,,,,,,,,,,,,,,,,,,,,,,,,,,,,,,,,,,,,,,,,,,,,,,,,,,,,448280,,,,,,,,,,,,,,,,,,,,,,,,,,,,,,,,,,,,,,,
"COMPAÑIA MEXICANA DE PROTECCION S DE RL DE CV",MPR120724RW8,,,,,,,,,,,,,,,,,,,,,,,,,,,,,,,,,,,,,,,,,,,,,,,,,,,,,,,13212042,,,,,,,,,,,,,,,,,,,,,,,,,,,,,,,,,,,,,,,
"GRUPO CONSTRUCTOR INTELLIGENT MAVICMEX SA DE CV",GCI160721JY7,,,,,,,,,,,,,,,,,,,,,,,,,,,,,,,,,,,,,,,,,,,,,,,,,,,,,,,19496147,,,,,,,,,,,,,,,,,,,,,,,,,,,,,,,,,,,,,,,
"IECRIMT INSTITUTO DE ESTUDIOS CRIMINOLOGICOS TRANSDISCIPLINARIOS SC ",IIE140408KG8,,,,,,,,,,,,,,,,,,,,,,,,,,,,,,,,,,,,,,,,,,,,,,,,,,,,,,,2068965,,,,,,,,,,,,,,,,,,,,,,,,,,,,,,,,,,,,,,,
"SOLUCIONES INTEGRALES EN SEGURIDAD Y EQUIPOS DE EMERGENCIA SA DE CV",SIS090113S32,,,,,,,,,,,,,,,,,,,,,,,,,,,,,,,,,,,,,,,,,,,,,,,,,,,,,,,3548500,,,,,,,,,,,,,,,,,,,,,,,,,,,,,,,,,,,,,,,
"SERVIESTRUCT SA DE CV",SER010215C41,,,,,,,,,,,,,,,,,,,,,,,,,,,,,,,,,,,,,,,,,,,,,,,,,,,,,,,940749,,,,,,,,,,,,,,,,,,,,,,,,,,,,,,,,,,,,,,,
"SERVICIOS JAVIT S.A. DE C.V. ",,,,,,,,,,,,,,,,,,,,,,,,,,,,,,,,,,,,,,,,,,,,,,,,,,,,,,,,170246,,,,,,,,,,,,,,,,,,,,,,,,,,,,,,,,,,,,,,,
"IRMA GARCIA ZURITA",,,,,,,,,,,,,,,,,,,,,,,,,,,,,,,,,,,,,,,,,,,,,,,,,,,,,,,,4223444,,,,,,,,,,,,,,,,,,,,,,,,,,,,,,,,,,,,,,,
"DISTRIBUIDORA GENERAL DE MEXICO GE SA DE CV",DGM180406J85,,,,,,,,,,,,,,,,,,,,,,,,,,,,,,,,,,,,,,,,,,,,,,,,,,,,,,,166949,,,,,,,,,,,,,,,,,,,,,,,,,,,,,,,,,,,,,,,
"VECTORPRO S DE RL DE CV",VEC140718AGA,,,,,,,,,,,,,,,,,,,,,,,,,,,,,,,,,,,,,,,,,,,,,,,,,,,,,,,1086082,,,,,,,,,,,,,,,,,,,,,,,,,,,,,,,,,,,,,,,
"MARTHA PATRICIA TOLEDO RANGEL",,,,,,,,,,,,,,,,,,,,,,,,,,,,,,,,,,,,,,,,,,,,,,,,,,,,,,,,976100,,,,,,,,,,,,,,,,,,,,,,,,,,,,,,,,,,,,,,,
"FUNDACION MEXICANA DE ESTUDIOS SOBRE INSEGURIDAD AC",FME100505LF4,,,,,,,,,,,,,,,,,,,,,,,,,,,,,,,,,,,,,,,,,,,,,,,,,,,,,,,775862,,,,,,,,,,,,,,,,,,,,,,,,,,,,,,,,,,,,,,,
"DESARROLLADORA VENDOR, S.A.DE C.V.",,,,,,,,,,,,,,,,,,,,,,,,,,,,,,,,,,,,,,,,,,,,,,,,,,,,,,,,1406012,,,,,,,,,,,,,,,,,,,,,,,,,,,,,,,,,,,,,,,
"CONSTRUCTORA ELECTRICA RURAL MARTINEZ SA DE CV",CER011101PK8,,,,,,,,,,,,,,,,,,,,,,,,,,,,,,,,,,,,,,,,,,,,,,,,,,,,,,,7143853,,,,,,,,,,,,,,,,,,,,,,,,,,,,,,,,,,,,,,,
"CONSTRUCTORA ELECTRICA RURAL MARTINEZ SA DE CV",CER011101PK8,,,,,,,,,,,,,,,,,,,,,,,,,,,,,,,,,,,,,,,,,,,,,,,,,,,,,,,8216314,,,,,,,,,,,,,,,,,,,,,,,,,,,,,,,,,,,,,,,
"SIMON ELECTRICA SA DE CV",SEL0204041U6,,,,,,,,,,,,,,,,,,,,,,,,,,,,,,,,,,,,,,,,,,,,,,,,,,,,,,,17929396,,,,,,,,,,,,,,,,,,,,,,,,,,,,,,,,,,,,,,,
"CONSTRUCCIONES CIVILES JIMCAR",CCJ060821SY7,,,,,,,,,,,,,,,,,,,,,,,,,,,,,,,,,,,,,,,,,,,,,,,,,,,,,,,2820165,,,,,,,,,,,,,,,,,,,,,,,,,,,,,,,,,,,,,,,
"CONSTRUCTORA TEGEO, S.A. DE C.V.",,,,,,,,,,,,,,,,,,,,,,,,,,,,,,,,,,,,,,,,,,,,,,,,,,,,,,,,2935042,,,,,,,,,,,,,,,,,,,,,,,,,,,,,,,,,,,,,,,
"CONSORCIO EN CONSTRUCCIONES  Y PROYECTOS LERANT, S.A. DE C.V.",,,,,,,,,,,,,,,,,,,,,,,,,,,,,,,,,,,,,,,,,,,,,,,,,,,,,,,,1286110,,,,,,,,,,,,,,,,,,,,,,,,,,,,,,,,,,,,,,,
"ACTI SERVICIO MARALAR, S.A. DE C.V.",,,,,,,,,,,,,,,,,,,,,,,,,,,,,,,,,,,,,,,,,,,,,,,,,,,,,,,,17811,,,,,,,,,,,,,,,,,,,,,,,,,,,,,,,,,,,,,,,
"LORENA OLEA HERNANDEZ",,,,,,,,,,,,,,,,,,,,,,,,,,,,,,,,,,,,,,,,,,,,,,,,,,,,,,,,12480,,,,,,,,,,,,,,,,,,,,,,,,,,,,,,,,,,,,,,,
"CONSTRUCTORA GISOL SA DE CV",CGI790301QD9,,,,,,,,,,,,,,,,,,,,,,,,,,,,,,,,,,,,,,,,,,,,,,,,,,,,,,,48703888,,,,,,,,,,,,,,,,,,,,,,,,,,,,,,,,,,,,,,,
"SONI UNIVERSIDAD S.A. DE C.V.",,,,,,,,,,,,,,,,,,,,,,,,,,,,,,,,,,,,,,,,,,,,,,,,,,,,,,,,1137931,,,,,,,,,,,,,,,,,,,,,,,,,,,,,,,,,,,,,,,
"SAUCEDO RUBIO VICENTE",,,,,,,,,,,,,,,,,,,,,,,,,,,,,,,,,,,,,,,,,,,,,,,,,,,,,,,,701509,,,,,,,,,,,,,,,,,,,,,,,,,,,,,,,,,,,,,,,
"IVAN ENRIQUEZ SILVA ",,,,,,,,,,,,,,,,,,,,,,,,,,,,,,,,,,,,,,,,,,,,,,,,,,,,,,,,76559,,,,,,,,,,,,,,,,,,,,,,,,,,,,,,,,,,,,,,,
"IVAN ENRIQUEZ SILVA ",,,,,,,,,,,,,,,,,,,,,,,,,,,,,,,,,,,,,,,,,,,,,,,,,,,,,,,,69991,,,,,,,,,,,,,,,,,,,,,,,,,,,,,,,,,,,,,,,
"SISTEMAS INTEGRALES Y EMPRESARIAL EN CONSTRUCCION MALI, S.A. DE C.V.",,,,,,,,,,,,,,,,,,,,,,,,,,,,,,,,,,,,,,,,,,,,,,,,,,,,,,,,1001596,,,,,,,,,,,,,,,,,,,,,,,,,,,,,,,,,,,,,,,
"OBRAS PROYECTOS Y SISTEMAS, S.A DE C.V",,,,,,,,,,,,,,,,,,,,,,,,,,,,,,,,,,,,,,,,,,,,,,,,,,,,,,,,579934,,,,,,,,,,,,,,,,,,,,,,,,,,,,,,,,,,,,,,,
"ALEJANDRO FRAGOSO ORTIZ",,,,,,,,,,,,,,,,,,,,,,,,,,,,,,,,,,,,,,,,,,,,,,,,,,,,,,,,1266854,,,,,,,,,,,,,,,,,,,,,,,,,,,,,,,,,,,,,,,
"CONSTRUCTORA CORPIS, S.A. DE C.V.",,,,,,,,,,,,,,,,,,,,,,,,,,,,,,,,,,,,,,,,,,,,,,,,,,,,,,,,1664457,,,,,,,,,,,,,,,,,,,,,,,,,,,,,,,,,,,,,,,
"CONSORCIO EN CONSTRUCCIONES  Y PROYECTOS LERANT, S.A. DE C.V.",,,,,,,,,,,,,,,,,,,,,,,,,,,,,,,,,,,,,,,,,,,,,,,,,,,,,,,,1611719,,,,,,,,,,,,,,,,,,,,,,,,,,,,,,,,,,,,,,,
"CONSTRUCTORA TEGEO, S.A. DE C.V.",,,,,,,,,,,,,,,,,,,,,,,,,,,,,,,,,,,,,,,,,,,,,,,,,,,,,,,,1533828,,,,,,,,,,,,,,,,,,,,,,,,,,,,,,,,,,,,,,,
"AG CONSTRUCCION Y DISEÑO S.A. DE C.V.",,,,,,,,,,,,,,,,,,,,,,,,,,,,,,,,,,,,,,,,,,,,,,,,,,,,,,,,1244912,,,,,,,,,,,,,,,,,,,,,,,,,,,,,,,,,,,,,,,
"MODERNART ARQUITECTURA E INGENIERIA, S.A. DE C.V.",,,,,,,,,,,,,,,,,,,,,,,,,,,,,,,,,,,,,,,,,,,,,,,,,,,,,,,,775430,,,,,,,,,,,,,,,,,,,,,,,,,,,,,,,,,,,,,,,
"SIMON ELECTRICA SA DE CV",SEL0204041U6,,,,,,,,,,,,,,,,,,,,,,,,,,,,,,,,,,,,,,,,,,,,,,,,,,,,,,,7499970,,,,,,,,,,,,,,,,,,,,,,,,,,,,,,,,,,,,,,,
"CONSORCIO CONTINENTAL DE INFRAESTRUCTURA",CCI080324F50,,,,,,,,,,,,,,,,,,,,,,,,,,,,,,,,,,,,,,,,,,,,,,,,,,,,,,,9864999,,,,,,,,,,,,,,,,,,,,,,,,,,,,,,,,,,,,,,,
"CONSTRUCCIONES Y EDIFICACIONES COPERO, S.A. DE C.V.",,,,,,,,,,,,,,,,,,,,,,,,,,,,,,,,,,,,,,,,,,,,,,,,,,,,,,,,2125991,,,,,,,,,,,,,,,,,,,,,,,,,,,,,,,,,,,,,,,
"RENASER CENTRO DE DESARROLLO HUMANO AC",RCD131204UL5,,,,,,,,,,,,,,,,,,,,,,,,,,,,,,,,,,,,,,,,,,,,,,,,,,,,,,,121250,,,,,,,,,,,,,,,,,,,,,,,,,,,,,,,,,,,,,,,
"MANUEL DE JESUS TAPIA TRUJILLO",,,,,,,,,,,,,,,,,,,,,,,,,,,,,,,,,,,,,,,,,,,,,,,,,,,,,,,,523350,,,,,,,,,,,,,,,,,,,,,,,,,,,,,,,,,,,,,,,
"RODER CONSTRUCCIONES, S.A. DE C.V.",,,,,,,,,,,,,,,,,,,,,,,,,,,,,,,,,,,,,,,,,,,,,,,,,,,,,,,,1292738,,,,,,,,,,,,,,,,,,,,,,,,,,,,,,,,,,,,,,,
"CONSTRUCTORA CORPIS, S.A. DE C.V.",,,,,,,,,,,,,,,,,,,,,,,,,,,,,,,,,,,,,,,,,,,,,,,,,,,,,,,,3042196,,,,,,,,,,,,,,,,,,,,,,,,,,,,,,,,,,,,,,,
"ALEJANDRO FRAGOSO ORTIZ",,,,,,,,,,,,,,,,,,,,,,,,,,,,,,,,,,,,,,,,,,,,,,,,,,,,,,,,1684253,,,,,,,,,,,,,,,,,,,,,,,,,,,,,,,,,,,,,,,
"PAVIMENTOS Y CONCRETOS DE TOLUCA SA DE CV",PCT1411258F1,,,,,,,,,,,,,,,,,,,,,,,,,,,,,,,,,,,,,,,,,,,,,,,,,,,,,,,2132299,,,,,,,,,,,,,,,,,,,,,,,,,,,,,,,,,,,,,,,
"SOLUCIONES CONSTRUCTIVAS MONTERO, S.A. DE C.V.",,,,,,,,,,,,,,,,,,,,,,,,,,,,,,,,,,,,,,,,,,,,,,,,,,,,,,,,6193176,,,,,,,,,,,,,,,,,,,,,,,,,,,,,,,,,,,,,,,
"CIDER, CENTRO INTEGRAL DE DECORACION Y RECUBRIMIENTO SA DE CV",CCI121204QI8,,,,,,,,,,,,,,,,,,,,,,,,,,,,,,,,,,,,,,,,,,,,,,,,,,,,,,,828798,,,,,,,,,,,,,,,,,,,,,,,,,,,,,,,,,,,,,,,
"MARTHA PATRICIA TOLEDO RANGEL",,,,,,,,,,,,,,,,,,,,,,,,,,,,,,,,,,,,,,,,,,,,,,,,,,,,,,,,280714,,,,,,,,,,,,,,,,,,,,,,,,,,,,,,,,,,,,,,,
"GRUPO CORPBO SA DE CV",GCO120223QB4,,,,,,,,,,,,,,,,,,,,,,,,,,,,,,,,,,,,,,,,,,,,,,,,,,,,,,,2114263,,,,,,,,,,,,,,,,,,,,,,,,,,,,,,,,,,,,,,,
"CONSTRUCCIONES Y EDIFICACIONES COPERO, S.A. DE C.V.",,,,,,,,,,,,,,,,,,,,,,,,,,,,,,,,,,,,,,,,,,,,,,,,,,,,,,,,5778514,,,,,,,,,,,,,,,,,,,,,,,,,,,,,,,,,,,,,,,
"CESUP CENTRO DE SEGURIDAD URBANA Y PREVENCIÓN, S.C.",,,,,,,,,,,,,,,,,,,,,,,,,,,,,,,,,,,,,,,,,,,,,,,,,,,,,,,,103448,,,,,,,,,,,,,,,,,,,,,,,,,,,,,,,,,,,,,,,
"SERVICIOS BROXEL S A P I DE CV",SBR130327HU9,,,,,,,,,,,,,,,,,,,,,,,,,,,,,,,,,,,,,,,,,,,,,,,,,,,,,,,1684800,,,,,,,,,,,,,,,,,,,,,,,,,,,,,,,,,,,,,,,
"CLAUDIA PIÑA HERRERA",,,,,,,,,,,,,,,,,,,,,,,,,,,,,,,,,,,,,,,,,,,,,,,,,,,,,,,,8190419,,,,,,,,,,,,,,,,,,,,,,,,,,,,,,,,,,,,,,,
"ERGONOMÍA MEXICANA, S.A. DE C.V.",,,,,,,,,,,,,,,,,,,,,,,,,,,,,,,,,,,,,,,,,,,,,,,,,,,,,,,,3113158,,,,,,,,,,,,,,,,,,,,,,,,,,,,,,,,,,,,,,,
"FRATER COMERCIALIZADORA S.A. DE C.V.",,,,,,,,,,,,,,,,,,,,,,,,,,,,,,,,,,,,,,,,,,,,,,,,,,,,,,,,22723,,,,,,,,,,,,,,,,,,,,,,,,,,,,,,,,,,,,,,,
"CHUBB SEGUROS MEXICO SA",ASE901221SM4,,,,,,,,,,,,,,,,,,,,,,,,,,,,,,,,,,,,,,,,,,,,,,,,,,,,,,,334398,,,,,,,,,,,,,,,,,,,,,,,,,,,,,,,,,,,,,,,
"DESARROLLADORA VENDOR, S.A.DE C.V.",,,,,,,,,,,,,,,,,,,,,,,,,,,,,,,,,,,,,,,,,,,,,,,,,,,,,,,,2791242,,,,,,,,,,,,,,,,,,,,,,,,,,,,,,,,,,,,,,,
"C V M CONSTRUCCIONES, S.A. DE C.V.",,,,,,,,,,,,,,,,,,,,,,,,,,,,,,,,,,,,,,,,,,,,,,,,,,,,,,,,2067949,,,,,,,,,,,,,,,,,,,,,,,,,,,,,,,,,,,,,,,
"MODERNART ARQUITECTURA E INGENIERIA, S.A. DE C.V.",,,,,,,,,,,,,,,,,,,,,,,,,,,,,,,,,,,,,,,,,,,,,,,,,,,,,,,,559186,,,,,,,,,,,,,,,,,,,,,,,,,,,,,,,,,,,,,,,
"AIRBUS SLC, S.A. DE C.V.",,,,,,,,,,,,,,,,,,,,,,,,,,,,,,,,,,,,,,,,,,,,,,,,,,,,,,,,495117,,,,,,,,,,,,,,,,,,,,,,,,,,,,,,,,,,,,,,,
"CONSTRUCCIONES Y PERFORACIONES ZYER, S.A. DE C.V",CPZ9705275C3,,,,,,,,,,,,,,,,,,,,,,,,,,,,,,,,,,,,,,,,,,,,,,,,,,,,,,,3870590,,,,,,,,,,,,,,,,,,,,,,,,,,,,,,,,,,,,,,,
"DIACSA DISEÑO, ARQUITECTURA Y CONSTRUCCIÒN, S.A. DE C.V.",,,,,,,,,,,,,,,,,,,,,,,,,,,,,,,,,,,,,,,,,,,,,,,,,,,,,,,,1550148,,,,,,,,,,,,,,,,,,,,,,,,,,,,,,,,,,,,,,,
"ABSPRO SA DE CV",ABS1110215N0,,,,,,,,,,,,,,,,,,,,,,,,,,,,,,,,,,,,,,,,,,,,,,,,,,,,,,,403200,,,,,,,,,,,,,,,,,,,,,,,,,,,,,,,,,,,,,,,
"CONSTRUCTORA TEGEO, S.A. DE C.V.",,,,,,,,,,,,,,,,,,,,,,,,,,,,,,,,,,,,,,,,,,,,,,,,,,,,,,,,2465454,,,,,,,,,,,,,,,,,,,,,,,,,,,,,,,,,,,,,,,
"AUTOMOTRIZ NIHON SA DE CV",ANI140616N87,,,,,,,,,,,,,,,,,,,,,,,,,,,,,,,,,,,,,,,,,,,,,,,,,,,,,,,1421637,,,,,,,,,,,,,,,,,,,,,,,,,,,,,,,,,,,,,,,
"KOREAN MOTORS SA DE CV",CCO130214C53,,,,,,,,,,,,,,,,,,,,,,,,,,,,,,,,,,,,,,,,,,,,,,,,,,,,,,,706689,,,,,,,,,,,,,,,,,,,,,,,,,,,,,,,,,,,,,,,
"CONTINENTAL AUTOMOTRIZ SA DE CV ",CAU8610017F5,,,,,,,,,,,,,,,,,,,,,,,,,,,,,,,,,,,,,,,,,,,,,,,,,,,,,,,732318,,,,,,,,,,,,,,,,,,,,,,,,,,,,,,,,,,,,,,,
"CONSTRUCCIONES Y PERFORACIONES ZYER, S.A. DE C.V",CPZ9705275C3,,,,,,,,,,,,,,,,,,,,,,,,,,,,,,,,,,,,,,,,,,,,,,,,,,,,,,,3871155,,,,,,,,,,,,,,,,,,,,,,,,,,,,,,,,,,,,,,,
"COPEM SA DE CV",COP080326T25,,,,,,,,,,,,,,,,,,,,,,,,,,,,,,,,,,,,,,,,,,,,,,,,,,,,,,,3787232,,,,,,,,,,,,,,,,,,,,,,,,,,,,,,,,,,,,,,,
"COMERCIALIZADORA, PAVIMENTACIONES Y EDIFICACIONES GRUCOCI SA DE CV",CPE170509367,,,,,,,,,,,,,,,,,,,,,,,,,,,,,,,,,,,,,,,,,,,,,,,,,,,,,,,7195487,,,,,,,,,,,,,,,,,,,,,,,,,,,,,,,,,,,,,,,
"JOSE ANTONIO GARDUÑO PEREZ",,,,,,,,,,,,,,,,,,,,,,,,,,,,,,,,,,,,,,,,,,,,,,,,,,,,,,,,2357509,,,,,,,,,,,,,,,,,,,,,,,,,,,,,,,,,,,,,,,
"ILLHUICATZIN SA DE CV",ILH140701KGA,,,,,,,,,,,,,,,,,,,,,,,,,,,,,,,,,,,,,,,,,,,,,,,,,,,,,,,1447308,,,,,,,,,,,,,,,,,,,,,,,,,,,,,,,,,,,,,,,
"JUAN CARLOS FLORES ALMAZAN ",,,,,,,,,,,,,,,,,,,,,,,,,,,,,,,,,,,,,,,,,,,,,,,,,,,,,,,,12522314,,,,,,,,,,,,,,,,,,,,,,,,,,,,,,,,,,,,,,,
"RIGOBERTO CARDENAS ALCANTARA ",,,,,,,,,,,,,,,,,,,,,,,,,,,,,,,,,,,,,,,,,,,,,,,,,,,,,,,,7201663,,,,,,,,,,,,,,,,,,,,,,,,,,,,,,,,,,,,,,,
"PRODUCE CONSTRUCCIONES S.A. DE C.V.",,,,,,,,,,,,,,,,,,,,,,,,,,,,,,,,,,,,,,,,,,,,,,,,,,,,,,,,1018019,,,,,,,,,,,,,,,,,,,,,,,,,,,,,,,,,,,,,,,
"MODERNART ARQUITECTURA E INGENIERIA, S.A. DE C.V.",,,,,,,,,,,,,,,,,,,,,,,,,,,,,,,,,,,,,,,,,,,,,,,,,,,,,,,,2498188,,,,,,,,,,,,,,,,,,,,,,,,,,,,,,,,,,,,,,,
"ARMONIA Y DISEÑO, S.A DE C.V.",,,,,,,,,,,,,,,,,,,,,,,,,,,,,,,,,,,,,,,,,,,,,,,,,,,,,,,,158089,,,,,,,,,,,,,,,,,,,,,,,,,,,,,,,,,,,,,,,
"DESARROLLADORA VENDOR, S.A.DE C.V.",,,,,,,,,,,,,,,,,,,,,,,,,,,,,,,,,,,,,,,,,,,,,,,,,,,,,,,,1293057,,,,,,,,,,,,,,,,,,,,,,,,,,,,,,,,,,,,,,,
"C V M CONSTRUCCIONES, S.A. DE C.V.",,,,,,,,,,,,,,,,,,,,,,,,,,,,,,,,,,,,,,,,,,,,,,,,,,,,,,,,1720080,,,,,,,,,,,,,,,,,,,,,,,,,,,,,,,,,,,,,,,
"SODERBERG & TRESCACONSULTING S.A. DE C.V.",,,,,,,,,,,,,,,,,,,,,,,,,,,,,,,,,,,,,,,,,,,,,,,,,,,,,,,,2284034,,,,,,,,,,,,,,,,,,,,,,,,,,,,,,,,,,,,,,,
"CORPORATIVO LUMY CONSTRUCCION Y DISEÑO SA DE CV",CLC141031NBA,,,,,,,,,,,,,,,,,,,,,,,,,,,,,,,,,,,,,,,,,,,,,,,,,,,,,,,5879186,,,,,,,,,,,,,,,,,,,,,,,,,,,,,,,,,,,,,,,
"OLICER CONSTRUCCIONES Y PAVIMENTACIONES S.A. DE C.V. ",,,,,,,,,,,,,,,,,,,,,,,,,,,,,,,,,,,,,,,,,,,,,,,,,,,,,,,,4039057,,,,,,,,,,,,,,,,,,,,,,,,,,,,,,,,,,,,,,,
"RODER CONSTRUCCIONES, S.A. DE C.V.",,,,,,,,,,,,,,,,,,,,,,,,,,,,,,,,,,,,,,,,,,,,,,,,,,,,,,,,1514626,,,,,,,,,,,,,,,,,,,,,,,,,,,,,,,,,,,,,,,
"COMERCIALIZADORA Y CONSTRUCTORA NITA",,,,,,,,,,,,,,,,,,,,,,,,,,,,,,,,,,,,,,,,,,,,,,,,,,,,,,,,486610,,,,,,,,,,,,,,,,,,,,,,,,,,,,,,,,,,,,,,,
"CONSORCIO EN CONSTRUCCIONES Y PROYECTOS LERANT, S.A. DE C. V.",,,,,,,,,,,,,,,,,,,,,,,,,,,,,,,,,,,,,,,,,,,,,,,,,,,,,,,,5968799,,,,,,,,,,,,,,,,,,,,,,,,,,,,,,,,,,,,,,,
"MULTICONSTRUCCIONES CALVARIO S.A. DE C.V.",,,,,,,,,,,,,,,,,,,,,,,,,,,,,,,,,,,,,,,,,,,,,,,,,,,,,,,,1752036,,,,,,,,,,,,,,,,,,,,,,,,,,,,,,,,,,,,,,,
"SAUCEDO RUBIO VICENTE",,,,,,,,,,,,,,,,,,,,,,,,,,,,,,,,,,,,,,,,,,,,,,,,,,,,,,,,1069039,,,,,,,,,,,,,,,,,,,,,,,,,,,,,,,,,,,,,,,
"ALEJANDRO FRAGOSO ORTIZ",,,,,,,,,,,,,,,,,,,,,,,,,,,,,,,,,,,,,,,,,,,,,,,,,,,,,,,,378057,,,,,,,,,,,,,,,,,,,,,,,,,,,,,,,,,,,,,,,
"ALEJANDRO FRAGOSO ORTIZ",,,,,,,,,,,,,,,,,,,,,,,,,,,,,,,,,,,,,,,,,,,,,,,,,,,,,,,,145983,,,,,,,,,,,,,,,,,,,,,,,,,,,,,,,,,,,,,,,
"C V M CONSTRUCCIONES, S.A. DE C.V.",,,,,,,,,,,,,,,,,,,,,,,,,,,,,,,,,,,,,,,,,,,,,,,,,,,,,,,,5167986,,,,,,,,,,,,,,,,,,,,,,,,,,,,,,,,,,,,,,,
"ALEJANDRO FRAGOSO ORTIZ",,,,,,,,,,,,,,,,,,,,,,,,,,,,,,,,,,,,,,,,,,,,,,,,,,,,,,,,1382830,,,,,,,,,,,,,,,,,,,,,,,,,,,,,,,,,,,,,,,
"MODERNART ARQUITECTURA E INGENIERIA, S.A. DE C.V.",,,,,,,,,,,,,,,,,,,,,,,,,,,,,,,,,,,,,,,,,,,,,,,,,,,,,,,,1420659,,,,,,,,,,,,,,,,,,,,,,,,,,,,,,,,,,,,,,,
"NILDA LEONOR SÁNCHEZ MORALES",,,,,,,,,,,,,,,,,,,,,,,,,,,,,,,,,,,,,,,,,,,,,,,,,,,,,,,,155172,,,,,,,,,,,,,,,,,,,,,,,,,,,,,,,,,,,,,,,
"LOMVILSA EDIFICACION S.A. DE C. V.",,,,,,,,,,,,,,,,,,,,,,,,,,,,,,,,,,,,,,,,,,,,,,,,,,,,,,,,825736,,,,,,,,,,,,,,,,,,,,,,,,,,,,,,,,,,,,,,,
"CONSTRUCCIONES Y EDIFICACIONES COPERO, S.A. DE C.V.",,,,,,,,,,,,,,,,,,,,,,,,,,,,,,,,,,,,,,,,,,,,,,,,,,,,,,,,10503216,,,,,,,,,,,,,,,,,,,,,,,,,,,,,,,,,,,,,,,
"LUIS ALBERTO AHEDO CASALES",,,,,,,,,,,,,,,,,,,,,,,,,,,,,,,,,,,,,,,,,,,,,,,,,,,,,,,,861967,,,,,,,,,,,,,,,,,,,,,,,,,,,,,,,,,,,,,,,
"GRUPO ARQUITECTÓNICO DE DESARROLLO INTEGRAL ROVEHE S.A. DE C.V.",,,,,,,,,,,,,,,,,,,,,,,,,,,,,,,,,,,,,,,,,,,,,,,,,,,,,,,,2656980,,,,,,,,,,,,,,,,,,,,,,,,,,,,,,,,,,,,,,,
"C V M CONSTRUCCIONES, S.A. DE C.V.",,,,,,,,,,,,,,,,,,,,,,,,,,,,,,,,,,,,,,,,,,,,,,,,,,,,,,,,3099769,,,,,,,,,,,,,,,,,,,,,,,,,,,,,,,,,,,,,,,
"ALEJANDRO FRAGOSO ORTIZ",,,,,,,,,,,,,,,,,,,,,,,,,,,,,,,,,,,,,,,,,,,,,,,,,,,,,,,,430575,,,,,,,,,,,,,,,,,,,,,,,,,,,,,,,,,,,,,,,
"CONSORCIO EN CONSTRUCCIONES  Y PROYECTOS LERANT, S.A. DE C.V.",,,,,,,,,,,,,,,,,,,,,,,,,,,,,,,,,,,,,,,,,,,,,,,,,,,,,,,,9883948,,,,,,,,,,,,,,,,,,,,,,,,,,,,,,,,,,,,,,,
"VICTOR ALEJANDRO SANCHEZ PALOMARES",,,,,,,,,,,,,,,,,,,,,,,,,,,,,,,,,,,,,,,,,,,,,,,,,,,,,,,,42980,,,,,,,,,,,,,,,,,,,,,,,,,,,,,,,,,,,,,,,
"ALEJANDRO FRAGOSO ORTIZ",,,,,,,,,,,,,,,,,,,,,,,,,,,,,,,,,,,,,,,,,,,,,,,,,,,,,,,,427704,,,,,,,,,,,,,,,,,,,,,,,,,,,,,,,,,,,,,,,
"SAUCEDO RUBIO VICENTE",,,,,,,,,,,,,,,,,,,,,,,,,,,,,,,,,,,,,,,,,,,,,,,,,,,,,,,,521971,,,,,,,,,,,,,,,,,,,,,,,,,,,,,,,,,,,,,,,
"""GRUPO R&M CONSTRUCCIONES"" SA DE CV",GRC091221SG6,,,,,,,,,,,,,,,,,,,,,,,,,,,,,,,,,,,,,,,,,,,,,,,,,,,,,,,3008300,,,,,,,,,,,,,,,,,,,,,,,,,,,,,,,,,,,,,,,
"CONSTRUCTORA E INMOBILIARIA CALULA SA DE CV",CIC0311249W1,,,,,,,,,,,,,,,,,,,,,,,,,,,,,,,,,,,,,,,,,,,,,,,,,,,,,,,3518213,,,,,,,,,,,,,,,,,,,,,,,,,,,,,,,,,,,,,,,
