"C V M CONSTRUCCIONES, S.A. DE C.V.",,,,,,,,,,,,,,,,,,,,,,,,,,,,,,,,,,,,,,,,,,,,,,,,,,,,,,,,8597793,,,,,,,,,,,,,,,,,,,,,,,,,,,,,,,,,,,,,,,
"DESARROLLADORA VENDOR, S.A.DE C.V.",,,,,,,,,,,,,,,,,,,,,,,,,,,,,,,,,,,,,,,,,,,,,,,,,,,,,,,,168034,,,,,,,,,,,,,,,,,,,,,,,,,,,,,,,,,,,,,,,
" CONSTRUCTORA TEGEO S.A. DE C.V.",,,,,,,,,,,,,,,,,,,,,,,,,,,,,,,,,,,,,,,,,,,,,,,,,,,,,,,,862023,,,,,,,,,,,,,,,,,,,,,,,,,,,,,,,,,,,,,,,
"GH CONSTRUCONSULTORES S.A. DE C.V.",,,,,,,,,,,,,,,,,,,,,,,,,,,,,,,,,,,,,,,,,,,,,,,,,,,,,,,,2348231,,,,,,,,,,,,,,,,,,,,,,,,,,,,,,,,,,,,,,,
"LIDIA HERNANDEZ CARMONA",,,,,,,,,,,,,,,,,,,,,,,,,,,,,,,,,,,,,,,,,,,,,,,,,,,,,,,,5292681,,,,,,,,,,,,,,,,,,,,,,,,,,,,,,,,,,,,,,,
" CONSTRUCTORA TEGEO S.A. DE C.V.",,,,,,,,,,,,,,,,,,,,,,,,,,,,,,,,,,,,,,,,,,,,,,,,,,,,,,,,934713,,,,,,,,,,,,,,,,,,,,,,,,,,,,,,,,,,,,,,,
"ARQUITECTURA Y SERVICIOS SUSTENTABLES DE LA CONSTRUCCIÓN S.A. DE C.V.",,,,,,,,,,,,,,,,,,,,,,,,,,,,,,,,,,,,,,,,,,,,,,,,,,,,,,,,6535467,,,,,,,,,,,,,,,,,,,,,,,,,,,,,,,,,,,,,,,
"CONSTRUCTORA CORPIS",,,,,,,,,,,,,,,,,,,,,,,,,,,,,,,,,,,,,,,,,,,,,,,,,,,,,,,,319975,,,,,,,,,,,,,,,,,,,,,,,,,,,,,,,,,,,,,,,
" CONSTRUCTORA TEGEO S.A. DE C.V.",,,,,,,,,,,,,,,,,,,,,,,,,,,,,,,,,,,,,,,,,,,,,,,,,,,,,,,,2181285,,,,,,,,,,,,,,,,,,,,,,,,,,,,,,,,,,,,,,,
"ALQUISERVIMAQ S.A. DE C.V.",,,,,,,,,,,,,,,,,,,,,,,,,,,,,,,,,,,,,,,,,,,,,,,,,,,,,,,,6545018,,,,,,,,,,,,,,,,,,,,,,,,,,,,,,,,,,,,,,,
"PRODUCE CONSTRUCCIONES S.A. DE C.V.",,,,,,,,,,,,,,,,,,,,,,,,,,,,,,,,,,,,,,,,,,,,,,,,,,,,,,,,768485,,,,,,,,,,,,,,,,,,,,,,,,,,,,,,,,,,,,,,,
"CONSTRUCCIONES Y EDIFICACIONES COPERO S.A. DE C.V.",,,,,,,,,,,,,,,,,,,,,,,,,,,,,,,,,,,,,,,,,,,,,,,,,,,,,,,,3299310,,,,,,,,,,,,,,,,,,,,,,,,,,,,,,,,,,,,,,,
"CONSORCIO EN CONSTRUCCIONES Y PROYECTOS LERANT, S.A. DE C. V.",,,,,,,,,,,,,,,,,,,,,,,,,,,,,,,,,,,,,,,,,,,,,,,,,,,,,,,,573212,,,,,,,,,,,,,,,,,,,,,,,,,,,,,,,,,,,,,,,
"CONSTRUCCIONES Y EDIFICACIONES COPERO S.A. DE C.V.",,,,,,,,,,,,,,,,,,,,,,,,,,,,,,,,,,,,,,,,,,,,,,,,,,,,,,,,4579741,,,,,,,,,,,,,,,,,,,,,,,,,,,,,,,,,,,,,,,
"ARMONIA Y DISEÑO, S.A DE C.V.",,,,,,,,,,,,,,,,,,,,,,,,,,,,,,,,,,,,,,,,,,,,,,,,,,,,,,,,933839,,,,,,,,,,,,,,,,,,,,,,,,,,,,,,,,,,,,,,,
"VICTOR ALEJANDRO SANCHEZ PALOMARES",,,,,,,,,,,,,,,,,,,,,,,,,,,,,,,,,,,,,,,,,,,,,,,,,,,,,,,,42890,,,,,,,,,,,,,,,,,,,,,,,,,,,,,,,,,,,,,,,
"CONSORCIO EN CONSTRUCCIONES Y PROYECTOS LERANT, S.A. DE C. V.",,,,,,,,,,,,,,,,,,,,,,,,,,,,,,,,,,,,,,,,,,,,,,,,,,,,,,,,2748750,,,,,,,,,,,,,,,,,,,,,,,,,,,,,,,,,,,,,,,
"SEGUROS SURA SA DE CV",,,,,,,,,,,,,,,,,,,,,,,,,,,,,,,,,,,,,,,,,,,,,,,,,,,,,,,,30586,,,,,,,,,,,,,,,,,,,,,,,,,,,,,,,,,,,,,,,
"ANTONIO ISRAEL BAEZA COSSIO",,,,,,,,,,,,,,,,,,,,,,,,,,,,,,,,,,,,,,,,,,,,,,,,,,,,,,,,137931,,,,,,,,,,,,,,,,,,,,,,,,,,,,,,,,,,,,,,,
"ARMONIA Y DISEÑO, S.A DE C.V.",,,,,,,,,,,,,,,,,,,,,,,,,,,,,,,,,,,,,,,,,,,,,,,,,,,,,,,,810673,,,,,,,,,,,,,,,,,,,,,,,,,,,,,,,,,,,,,,,
"LVR MAQUINAS, OBRAS Y SUPERVISION S.A. DE C.V.",,,,,,,,,,,,,,,,,,,,,,,,,,,,,,,,,,,,,,,,,,,,,,,,,,,,,,,,4205639,,,,,,,,,,,,,,,,,,,,,,,,,,,,,,,,,,,,,,,
"CONSTRUCTORA CORPIS",,,,,,,,,,,,,,,,,,,,,,,,,,,,,,,,,,,,,,,,,,,,,,,,,,,,,,,,1032010,,,,,,,,,,,,,,,,,,,,,,,,,,,,,,,,,,,,,,,
"MANUEL DE JESUS TAPIA TRUJILLO",,,,,,,,,,,,,,,,,,,,,,,,,,,,,,,,,,,,,,,,,,,,,,,,,,,,,,,,1384140,,,,,,,,,,,,,,,,,,,,,,,,,,,,,,,,,,,,,,,
"CONSTRUCTORA CORPIS",,,,,,,,,,,,,,,,,,,,,,,,,,,,,,,,,,,,,,,,,,,,,,,,,,,,,,,,1856828,,,,,,,,,,,,,,,,,,,,,,,,,,,,,,,,,,,,,,,
"IVAN RICKI RAMIREZ GALLEGOS",,,,,,,,,,,,,,,,,,,,,,,,,,,,,,,,,,,,,,,,,,,,,,,,,,,,,,,,2155171,,,,,,,,,,,,,,,,,,,,,,,,,,,,,,,,,,,,,,,
"TEASA SMART SOLUTIONS SA DE CV",TSS1708149B6,,,,,,,,,,,,,,,,,,,,,,,,,,,,,,,,,,,,,,,,,,,,,,,,,,,,,,,2240529,,,,,,,,,,,,,,,,,,,,,,,,,,,,,,,,,,,,,,,
"LOMVILSA EDIFICACION S.A. DE C. V.",,,,,,,,,,,,,,,,,,,,,,,,,,,,,,,,,,,,,,,,,,,,,,,,,,,,,,,,157204,,,,,,,,,,,,,,,,,,,,,,,,,,,,,,,,,,,,,,,
"GRUPO DESARROLLOS INTEGRALES EN INGENIERIA FEX S.A. DE C.V.",,,,,,,,,,,,,,,,,,,,,,,,,,,,,,,,,,,,,,,,,,,,,,,,,,,,,,,,4035493,,,,,,,,,,,,,,,,,,,,,,,,,,,,,,,,,,,,,,,
"GRUPO CONSTRUCTOR DEL VALLE DE MEXICO ZONA ORIENTE COVAMEZO SA DE CV",GCV110503LU0,,,,,,,,,,,,,,,,,,,,,,,,,,,,,,,,,,,,,,,,,,,,,,,,,,,,,,,9436509,,,,,,,,,,,,,,,,,,,,,,,,,,,,,,,,,,,,,,,
"ALEJANDO FRAGOSO ORTIZ",,,,,,,,,,,,,,,,,,,,,,,,,,,,,,,,,,,,,,,,,,,,,,,,,,,,,,,,275546,,,,,,,,,,,,,,,,,,,,,,,,,,,,,,,,,,,,,,,
"CONSTRUCCIONES RACIONALES OTZOL SA DE CV",CRO000301JZ8,,,,,,,,,,,,,,,,,,,,,,,,,,,,,,,,,,,,,,,,,,,,,,,,,,,,,,,5938144,,,,,,,,,,,,,,,,,,,,,,,,,,,,,,,,,,,,,,,
"SILVIA BECERRIL PEÑA",,,,,,,,,,,,,,,,,,,,,,,,,,,,,,,,,,,,,,,,,,,,,,,,,,,,,,,,52930,,,,,,,,,,,,,,,,,,,,,,,,,,,,,,,,,,,,,,,
"GARVATI CONSTRUCCIONES SA DE CV",GCO180802926,,,,,,,,,,,,,,,,,,,,,,,,,,,,,,,,,,,,,,,,,,,,,,,,,,,,,,,18580431,,,,,,,,,,,,,,,,,,,,,,,,,,,,,,,,,,,,,,,
"GRUPO CONSTRUCTOR DEL VALLE DE MEXICO ZONA ORIENTE COVAMEZO SA DE CV",GCV110503LU0,,,,,,,,,,,,,,,,,,,,,,,,,,,,,,,,,,,,,,,,,,,,,,,,,,,,,,,6034482,,,,,,,,,,,,,,,,,,,,,,,,,,,,,,,,,,,,,,,
"CONSORCIO EN CONSTRUCCIONES Y PROYECTOS LERANT, S.A. DE C. V.",,,,,,,,,,,,,,,,,,,,,,,,,,,,,,,,,,,,,,,,,,,,,,,,,,,,,,,,3255302,,,,,,,,,,,,,,,,,,,,,,,,,,,,,,,,,,,,,,,
"CONSORCIO EN CONSTRUCCIONES Y PROYECTOS LERANT, S.A. DE C. V.",,,,,,,,,,,,,,,,,,,,,,,,,,,,,,,,,,,,,,,,,,,,,,,,,,,,,,,,1101559,,,,,,,,,,,,,,,,,,,,,,,,,,,,,,,,,,,,,,,
"CONSTRUCTORA Y URBANIZADORA CRIBALSA S.A. DE C.V.",,,,,,,,,,,,,,,,,,,,,,,,,,,,,,,,,,,,,,,,,,,,,,,,,,,,,,,,2584400,,,,,,,,,,,,,,,,,,,,,,,,,,,,,,,,,,,,,,,
"IVAN RICKI RAMIREZ GALLEGOS",,,,,,,,,,,,,,,,,,,,,,,,,,,,,,,,,,,,,,,,,,,,,,,,,,,,,,,,2155169,,,,,,,,,,,,,,,,,,,,,,,,,,,,,,,,,,,,,,,
"ARMONIA Y DISEÑO, S.A DE C.V.",,,,,,,,,,,,,,,,,,,,,,,,,,,,,,,,,,,,,,,,,,,,,,,,,,,,,,,,132723,,,,,,,,,,,,,,,,,,,,,,,,,,,,,,,,,,,,,,,
"CONSTRUCCIONES Y EDIFICACIONES COPERO S.A. DE C.V.",,,,,,,,,,,,,,,,,,,,,,,,,,,,,,,,,,,,,,,,,,,,,,,,,,,,,,,,6692137,,,,,,,,,,,,,,,,,,,,,,,,,,,,,,,,,,,,,,,
"MIRANDA, ARANA VELAZCO S.C",,,,,,,,,,,,,,,,,,,,,,,,,,,,,,,,,,,,,,,,,,,,,,,,,,,,,,,,11131502,,,,,,,,,,,,,,,,,,,,,,,,,,,,,,,,,,,,,,,
"SOLUCIONES CONSTRUCTIVAS MONTERO, S.A. DE C.V.",,,,,,,,,,,,,,,,,,,,,,,,,,,,,,,,,,,,,,,,,,,,,,,,,,,,,,,,1064041,,,,,,,,,,,,,,,,,,,,,,,,,,,,,,,,,,,,,,,
"ELDA GOMEZ ROGEL",,,,,,,,,,,,,,,,,,,,,,,,,,,,,,,,,,,,,,,,,,,,,,,,,,,,,,,,689050,,,,,,,,,,,,,,,,,,,,,,,,,,,,,,,,,,,,,,,
"CONSULTORES Y CONSTRUCTORES DAGALO S.A. DE C.V.",,,,,,,,,,,,,,,,,,,,,,,,,,,,,,,,,,,,,,,,,,,,,,,,,,,,,,,,5977486,,,,,,,,,,,,,,,,,,,,,,,,,,,,,,,,,,,,,,,
"MODERNART ARQUITECTURA E INGENIERIA, S.A. DE C.V.",,,,,,,,,,,,,,,,,,,,,,,,,,,,,,,,,,,,,,,,,,,,,,,,,,,,,,,,81464,,,,,,,,,,,,,,,,,,,,,,,,,,,,,,,,,,,,,,,
"OBRAS PROYECTOS Y SISTEMAS, S.A DE C.V",,,,,,,,,,,,,,,,,,,,,,,,,,,,,,,,,,,,,,,,,,,,,,,,,,,,,,,,805105,,,,,,,,,,,,,,,,,,,,,,,,,,,,,,,,,,,,,,,
"OBRAS PROYECTOS Y SISTEMAS, S.A DE C.V",,,,,,,,,,,,,,,,,,,,,,,,,,,,,,,,,,,,,,,,,,,,,,,,,,,,,,,,63827,,,,,,,,,,,,,,,,,,,,,,,,,,,,,,,,,,,,,,,
"EDIFICACIONES YOLT S.A. DE C.V.",,,,,,,,,,,,,,,,,,,,,,,,,,,,,,,,,,,,,,,,,,,,,,,,,,,,,,,,1367603,,,,,,,,,,,,,,,,,,,,,,,,,,,,,,,,,,,,,,,
"PRODUCE CONSTRUCCIONES S.A. DE C.V.",,,,,,,,,,,,,,,,,,,,,,,,,,,,,,,,,,,,,,,,,,,,,,,,,,,,,,,,1271444,,,,,,,,,,,,,,,,,,,,,,,,,,,,,,,,,,,,,,,
"GRUPO DESARROLLOS INTEGRALES EN INGENIERIA FEX S.A. DE C.V.",,,,,,,,,,,,,,,,,,,,,,,,,,,,,,,,,,,,,,,,,,,,,,,,,,,,,,,,915131,,,,,,,,,,,,,,,,,,,,,,,,,,,,,,,,,,,,,,,
"ALEJANDO FRAGOSO ORTIZ",,,,,,,,,,,,,,,,,,,,,,,,,,,,,,,,,,,,,,,,,,,,,,,,,,,,,,,,363481,,,,,,,,,,,,,,,,,,,,,,,,,,,,,,,,,,,,,,,
"GERARDO ANDRADE HINOJOSA",,,,,,,,,,,,,,,,,,,,,,,,,,,,,,,,,,,,,,,,,,,,,,,,,,,,,,,,599397,,,,,,,,,,,,,,,,,,,,,,,,,,,,,,,,,,,,,,,
"DESARROLLADORA DE INFRAESTRUCTURA AMILCO, S.A. DE C.V. ",,,,,,,,,,,,,,,,,,,,,,,,,,,,,,,,,,,,,,,,,,,,,,,,,,,,,,,,7406891,,,,,,,,,,,,,,,,,,,,,,,,,,,,,,,,,,,,,,,
"CEBENSSI SA DE CV",CEB1709273S9,,,,,,,,,,,,,,,,,,,,,,,,,,,,,,,,,,,,,,,,,,,,,,,,,,,,,,,714655,,,,,,,,,,,,,,,,,,,,,,,,,,,,,,,,,,,,,,,
"VULCANO APLICACIONES CIENTÍFICAS E INGENIERÍA, S.A. DE C.V.",,,,,,,,,,,,,,,,,,,,,,,,,,,,,,,,,,,,,,,,,,,,,,,,,,,,,,,,16320000,,,,,,,,,,,,,,,,,,,,,,,,,,,,,,,,,,,,,,,
"INTERNATIONAL HOUSE MÉXICO, S.C. ",,,,,,,,,,,,,,,,,,,,,,,,,,,,,,,,,,,,,,,,,,,,,,,,,,,,,,,,5180660,,,,,,,,,,,,,,,,,,,,,,,,,,,,,,,,,,,,,,,
"GRUPO CONSTRUCTOR COAMSA, S.A. DE C.V. ",,,,,,,,,,,,,,,,,,,,,,,,,,,,,,,,,,,,,,,,,,,,,,,,,,,,,,,,1723514,,,,,,,,,,,,,,,,,,,,,,,,,,,,,,,,,,,,,,,
"GRUPO ESTRATEGICO SOYANI SA DE CV",GES190607JW1,,,,,,,,,,,,,,,,,,,,,,,,,,,,,,,,,,,,,,,,,,,,,,,,,,,,,,,50000,,,,,,,,,,,,,,,,,,,,,,,,,,,,,,,,,,,,,,,
"CONSFREDO S.A DE C.V ",,,,,,,,,,,,,,,,,,,,,,,,,,,,,,,,,,,,,,,,,,,,,,,,,,,,,,,,10384535,,,,,,,,,,,,,,,,,,,,,,,,,,,,,,,,,,,,,,,
"EDUMIL17, S.C.",,,,,,,,,,,,,,,,,,,,,,,,,,,,,,,,,,,,,,,,,,,,,,,,,,,,,,,,2077586,,,,,,,,,,,,,,,,,,,,,,,,,,,,,,,,,,,,,,,
"INFOESTRATEGICA LATINA SA DE CV",ILA020311473,,,,,,,,,,,,,,,,,,,,,,,,,,,,,,,,,,,,,,,,,,,,,,,,,,,,,,,224250,,,,,,,,,,,,,,,,,,,,,,,,,,,,,,,,,,,,,,,
"CREADEM CONSTRUCTORA SOCIEDAD ANÓNIMA DE CAPITAL VARIABLE ",,,,,,,,,,,,,,,,,,,,,,,,,,,,,,,,,,,,,,,,,,,,,,,,,,,,,,,,168455,,,,,,,,,,,,,,,,,,,,,,,,,,,,,,,,,,,,,,,
"PROVANOMIC SA DE CV",PRO071024AV6,,,,,,,,,,,,,,,,,,,,,,,,,,,,,,,,,,,,,,,,,,,,,,,,,,,,,,,6879182,,,,,,,,,,,,,,,,,,,,,,,,,,,,,,,,,,,,,,,
"CONSTRUCCIONES Y CONDUCCIONES SIGMA, S.A. DE C.V. ",,,,,,,,,,,,,,,,,,,,,,,,,,,,,,,,,,,,,,,,,,,,,,,,,,,,,,,,8070236,,,,,,,,,,,,,,,,,,,,,,,,,,,,,,,,,,,,,,,
"MICA MEJORA EN INGENIERIA Y CONSULTORIA APLICADA S DE RL",MMI110201DZ9,,,,,,,,,,,,,,,,,,,,,,,,,,,,,,,,,,,,,,,,,,,,,,,,,,,,,,,1799551,,,,,,,,,,,,,,,,,,,,,,,,,,,,,,,,,,,,,,,
"ILLHUICATZIN SA DE CV",ILH140701KGA,,,,,,,,,,,,,,,,,,,,,,,,,,,,,,,,,,,,,,,,,,,,,,,,,,,,,,,112491,,,,,,,,,,,,,,,,,,,,,,,,,,,,,,,,,,,,,,,
"MOISES REZA ROSALES",,,,,,,,,,,,,,,,,,,,,,,,,,,,,,,,,,,,,,,,,,,,,,,,,,,,,,,,235000,,,,,,,,,,,,,,,,,,,,,,,,,,,,,,,,,,,,,,,
"CONSTRUTREBOL DEL NORTE SA DE CV",CNO151127DP1,,,,,,,,,,,,,,,,,,,,,,,,,,,,,,,,,,,,,,,,,,,,,,,,,,,,,,,1599874,,,,,,,,,,,,,,,,,,,,,,,,,,,,,,,,,,,,,,,
"GRUPO CORPBO SA DE CV",GCO120223QB4,,,,,,,,,,,,,,,,,,,,,,,,,,,,,,,,,,,,,,,,,,,,,,,,,,,,,,,820981,,,,,,,,,,,,,,,,,,,,,,,,,,,,,,,,,,,,,,,
"INMOBILIARIA MEXICANA TURISTICA SA DE CV",,,,,,,,,,,,,,,,,,,,,,,,,,,,,,,,,,,,,,,,,,,,,,,,,,,,,,,,1632411,,,,,,,,,,,,,,,,,,,,,,,,,,,,,,,,,,,,,,,
"MCG, S.A. DE C.V. ",,,,,,,,,,,,,,,,,,,,,,,,,,,,,,,,,,,,,,,,,,,,,,,,,,,,,,,,1223761,,,,,,,,,,,,,,,,,,,,,,,,,,,,,,,,,,,,,,,
"POWER HIT SA DE CV",PHI150928659,,,,,,,,,,,,,,,,,,,,,,,,,,,,,,,,,,,,,,,,,,,,,,,,,,,,,,,5567835,,,,,,,,,,,,,,,,,,,,,,,,,,,,,,,,,,,,,,,
"BETSAR SA DE CV",BET111209RA0,,,,,,,,,,,,,,,,,,,,,,,,,,,,,,,,,,,,,,,,,,,,,,,,,,,,,,,2609600,,,,,,,,,,,,,,,,,,,,,,,,,,,,,,,,,,,,,,,
"EPIC SA DE CV",EPI070418MT6,,,,,,,,,,,,,,,,,,,,,,,,,,,,,,,,,,,,,,,,,,,,,,,,,,,,,,,1974211,,,,,,,,,,,,,,,,,,,,,,,,,,,,,,,,,,,,,,,
"VIDAC, S.A. DE C.V. ",,,,,,,,,,,,,,,,,,,,,,,,,,,,,,,,,,,,,,,,,,,,,,,,,,,,,,,,4275600,,,,,,,,,,,,,,,,,,,,,,,,,,,,,,,,,,,,,,,
"MICA MEJORA EN INGENIERIA Y CONSULTORIA APLICADA S DE RL",MMI110201DZ9,,,,,,,,,,,,,,,,,,,,,,,,,,,,,,,,,,,,,,,,,,,,,,,,,,,,,,,1982359,,,,,,,,,,,,,,,,,,,,,,,,,,,,,,,,,,,,,,,
"INTERNATIONAL HOUSE MÉXICO, S.C. ",,,,,,,,,,,,,,,,,,,,,,,,,,,,,,,,,,,,,,,,,,,,,,,,,,,,,,,,2402927,,,,,,,,,,,,,,,,,,,,,,,,,,,,,,,,,,,,,,,
"RODRIGUEZ VAZQUEZ AUDITORES CONSULTORES SC",,,,,,,,,,,,,,,,,,,,,,,,,,,,,,,,,,,,,,,,,,,,,,,,,,,,,,,,65500,,,,,,,,,,,,,,,,,,,,,,,,,,,,,,,,,,,,,,,
"TERCER ESCALON SA DE CV",TEE100407SS1,,,,,,,,,,,,,,,,,,,,,,,,,,,,,,,,,,,,,,,,,,,,,,,,,,,,,,,8500600,,,,,,,,,,,,,,,,,,,,,,,,,,,,,,,,,,,,,,,
"IMPULSORA DE DESARROLLO INTEGRAL SA DE CV",IDI930119FX2,,,,,,,,,,,,,,,,,,,,,,,,,,,,,,,,,,,,,,,,,,,,,,,,,,,,,,,103447480,,,,,,,,,,,,,,,,,,,,,,,,,,,,,,,,,,,,,,,
"CONSTRUCCIONES Y PROYECTOS EME SA DE CV",CPE030717HX7,,,,,,,,,,,,,,,,,,,,,,,,,,,,,,,,,,,,,,,,,,,,,,,,,,,,,,,9799148,,,,,,,,,,,,,,,,,,,,,,,,,,,,,,,,,,,,,,,
"ASOCIACION INTERNACIONAL POR LOS VALORES HUMANOS AC",AIV070824AD4,,,,,,,,,,,,,,,,,,,,,,,,,,,,,,,,,,,,,,,,,,,,,,,,,,,,,,,6437931,,,,,,,,,,,,,,,,,,,,,,,,,,,,,,,,,,,,,,,
"CONSTRUCCIONES Y PERFORACIONES ISJAN SA DE CV",CPI120615QS4,,,,,,,,,,,,,,,,,,,,,,,,,,,,,,,,,,,,,,,,,,,,,,,,,,,,,,,2396071,,,,,,,,,,,,,,,,,,,,,,,,,,,,,,,,,,,,,,,
"COMPAÑÍA CONSTRUCTORA E INMOBILIARIA KALTEC, S.A. DE C.V.",,,,,,,,,,,,,,,,,,,,,,,,,,,,,,,,,,,,,,,,,,,,,,,,,,,,,,,,4986188,,,,,,,,,,,,,,,,,,,,,,,,,,,,,,,,,,,,,,,
"XPRESION Y ALGO MAS, S.A. DE C.V.",,,,,,,,,,,,,,,,,,,,,,,,,,,,,,,,,,,,,,,,,,,,,,,,,,,,,,,,4651,,,,,,,,,,,,,,,,,,,,,,,,,,,,,,,,,,,,,,,
"FELICIANO VELAZQUEZ ALVAREZ",,,,,,,,,,,,,,,,,,,,,,,,,,,,,,,,,,,,,,,,,,,,,,,,,,,,,,,,1722707,,,,,,,,,,,,,,,,,,,,,,,,,,,,,,,,,,,,,,,
"CONSTRUCTORA NANABI XOÑIJUMU, S.A. DE C.V. ",,,,,,,,,,,,,,,,,,,,,,,,,,,,,,,,,,,,,,,,,,,,,,,,,,,,,,,,2372482,,,,,,,,,,,,,,,,,,,,,,,,,,,,,,,,,,,,,,,
"TECNOLOGÍA Y PUBLICIDAD WORKGE S.A DE C.V.",,,,,,,,,,,,,,,,,,,,,,,,,,,,,,,,,,,,,,,,,,,,,,,,,,,,,,,,44500,,,,,,,,,,,,,,,,,,,,,,,,,,,,,,,,,,,,,,,
"MARIA DE LOS ANGELES LUNA LUNA",,,,,,,,,,,,,,,,,,,,,,,,,,,,,,,,,,,,,,,,,,,,,,,,,,,,,,,,387650,,,,,,,,,,,,,,,,,,,,,,,,,,,,,,,,,,,,,,,
"INMOBILIARIA MEXICANA TURISTICA SA DE CV",IMT070806FN5,,,,,,,,,,,,,,,,,,,,,,,,,,,,,,,,,,,,,,,,,,,,,,,,,,,,,,,1729985,,,,,,,,,,,,,,,,,,,,,,,,,,,,,,,,,,,,,,,
"CONSTRUCCIONES Y PROYECTOS EME SA DE CV",CPE030717HX7,,,,,,,,,,,,,,,,,,,,,,,,,,,,,,,,,,,,,,,,,,,,,,,,,,,,,,,4038525,,,,,,,,,,,,,,,,,,,,,,,,,,,,,,,,,,,,,,,
"PROPAGANDA Y MAS SA DE CV",PMA0103061E5,,,,,,,,,,,,,,,,,,,,,,,,,,,,,,,,,,,,,,,,,,,,,,,,,,,,,,,10800,,,,,,,,,,,,,,,,,,,,,,,,,,,,,,,,,,,,,,,
"MARIA CONCEPCION SANCHEZ GARCIA",,,,,,,,,,,,,,,,,,,,,,,,,,,,,,,,,,,,,,,,,,,,,,,,,,,,,,,,4310,,,,,,,,,,,,,,,,,,,,,,,,,,,,,,,,,,,,,,,
"M Y D ESTUDIO ARQUITECTONICO SA DE CV",MDE150326TJ8,,,,,,,,,,,,,,,,,,,,,,,,,,,,,,,,,,,,,,,,,,,,,,,,,,,,,,,586115,,,,,,,,,,,,,,,,,,,,,,,,,,,,,,,,,,,,,,,
"EPIC SA DE CV",EPI070418MT6,,,,,,,,,,,,,,,,,,,,,,,,,,,,,,,,,,,,,,,,,,,,,,,,,,,,,,,1799192,,,,,,,,,,,,,,,,,,,,,,,,,,,,,,,,,,,,,,,
"ELISEO OROZCO BRISEÑO",,,,,,,,,,,,,,,,,,,,,,,,,,,,,,,,,,,,,,,,,,,,,,,,,,,,,,,,1499859,,,,,,,,,,,,,,,,,,,,,,,,,,,,,,,,,,,,,,,
"DESARROLLOS EL DORADO SA DE CV",DDO0001287R0,,,,,,,,,,,,,,,,,,,,,,,,,,,,,,,,,,,,,,,,,,,,,,,,,,,,,,,469780,,,,,,,,,,,,,,,,,,,,,,,,,,,,,,,,,,,,,,,
"CARLOS ANDRES ALVARADO MARMOLEJO",,,,,,,,,,,,,,,,,,,,,,,,,,,,,,,,,,,,,,,,,,,,,,,,,,,,,,,,90250,,,,,,,,,,,,,,,,,,,,,,,,,,,,,,,,,,,,,,,
"COMERCIALIZADORA GUIR, S.A. DE C.V. ",,,,,,,,,,,,,,,,,,,,,,,,,,,,,,,,,,,,,,,,,,,,,,,,,,,,,,,,1651441,,,,,,,,,,,,,,,,,,,,,,,,,,,,,,,,,,,,,,,
"INGENIERIA Y ARQUITECTURA MERUN, S.A. DE C.V. ",,,,,,,,,,,,,,,,,,,,,,,,,,,,,,,,,,,,,,,,,,,,,,,,,,,,,,,,1881055,,,,,,,,,,,,,,,,,,,,,,,,,,,,,,,,,,,,,,,
"GRUPO TECNOLOGIA HIDRICA Y PROYECTOS S DE RL DE CV",GTH1909036I1,,,,,,,,,,,,,,,,,,,,,,,,,,,,,,,,,,,,,,,,,,,,,,,,,,,,,,,1034482,,,,,,,,,,,,,,,,,,,,,,,,,,,,,,,,,,,,,,,
"CONSTRUCTORA E INMOBILIARIA CALULA, S.A. DE C.V. ",,,,,,,,,,,,,,,,,,,,,,,,,,,,,,,,,,,,,,,,,,,,,,,,,,,,,,,,5155966,,,,,,,,,,,,,,,,,,,,,,,,,,,,,,,,,,,,,,,
"PROMOTORA INDUSTRIAL DIRLUM SA DE CV",PID100322NP0,,,,,,,,,,,,,,,,,,,,,,,,,,,,,,,,,,,,,,,,,,,,,,,,,,,,,,,348299,,,,,,,,,,,,,,,,,,,,,,,,,,,,,,,,,,,,,,,
"POWER HIT SA DE CV",PHI150928659,,,,,,,,,,,,,,,,,,,,,,,,,,,,,,,,,,,,,,,,,,,,,,,,,,,,,,,385122,,,,,,,,,,,,,,,,,,,,,,,,,,,,,,,,,,,,,,,
"ALGE RAMIREZ CONSTRUCTORA S DE RL DE CV",ARC121018QW9,,,,,,,,,,,,,,,,,,,,,,,,,,,,,,,,,,,,,,,,,,,,,,,,,,,,,,,503578,,,,,,,,,,,,,,,,,,,,,,,,,,,,,,,,,,,,,,,
"GRUPO CORPORATIVO ANAFEL SA DE CV",GCA1905071C7,,,,,,,,,,,,,,,,,,,,,,,,,,,,,,,,,,,,,,,,,,,,,,,,,,,,,,,40600,,,,,,,,,,,,,,,,,,,,,,,,,,,,,,,,,,,,,,,
"TECNOLOGIA EN INFORMATICA MULTIPLE SA DE CV",TIM030714AU3,,,,,,,,,,,,,,,,,,,,,,,,,,,,,,,,,,,,,,,,,,,,,,,,,,,,,,,268843,,,,,,,,,,,,,,,,,,,,,,,,,,,,,,,,,,,,,,,
"SOCIAL HUB SC",SHU180326BR0,,,,,,,,,,,,,,,,,,,,,,,,,,,,,,,,,,,,,,,,,,,,,,,,,,,,,,,131801,,,,,,,,,,,,,,,,,,,,,,,,,,,,,,,,,,,,,,,
"ARVAK TACTICAL S DE RL DE CV",ATA181121MY9,,,,,,,,,,,,,,,,,,,,,,,,,,,,,,,,,,,,,,,,,,,,,,,,,,,,,,,322091,,,,,,,,,,,,,,,,,,,,,,,,,,,,,,,,,,,,,,,
"J.D.J. EQUIPO Y CONSTRUCCIONES SA DE CV",JEC040429LS4,,,,,,,,,,,,,,,,,,,,,,,,,,,,,,,,,,,,,,,,,,,,,,,,,,,,,,,5940983,,,,,,,,,,,,,,,,,,,,,,,,,,,,,,,,,,,,,,,
"MARIA DE LOS ANGELES LUNA LUNA",,,,,,,,,,,,,,,,,,,,,,,,,,,,,,,,,,,,,,,,,,,,,,,,,,,,,,,,387600,,,,,,,,,,,,,,,,,,,,,,,,,,,,,,,,,,,,,,,
"HENSA DISTRIBUCIONES SA DE CV",HDI8412229D8,,,,,,,,,,,,,,,,,,,,,,,,,,,,,,,,,,,,,,,,,,,,,,,,,,,,,,,323275,,,,,,,,,,,,,,,,,,,,,,,,,,,,,,,,,,,,,,,
"EPIC SA DE CV",EPI070418MT6,,,,,,,,,,,,,,,,,,,,,,,,,,,,,,,,,,,,,,,,,,,,,,,,,,,,,,,212077,,,,,,,,,,,,,,,,,,,,,,,,,,,,,,,,,,,,,,,
"ARVAK TACTICAL S DE RL DE CV",ATA181121MY9,,,,,,,,,,,,,,,,,,,,,,,,,,,,,,,,,,,,,,,,,,,,,,,,,,,,,,,121640,,,,,,,,,,,,,,,,,,,,,,,,,,,,,,,,,,,,,,,
"SEGUROS BANORTE SA DE CV",,,,,,,,,,,,,,,,,,,,,,,,,,,,,,,,,,,,,,,,,,,,,,,,,,,,,,,,64681,,,,,,,,,,,,,,,,,,,,,,,,,,,,,,,,,,,,,,,
"INMOBILIARIA MEXICANA TURISTICA SA DE CV",IMT070806FN5,,,,,,,,,,,,,,,,,,,,,,,,,,,,,,,,,,,,,,,,,,,,,,,,,,,,,,,340950,,,,,,,,,,,,,,,,,,,,,,,,,,,,,,,,,,,,,,,
"CONSTRUCCIONES Y PERFORACIONES ISJAN SA DE CV",,,,,,,,,,,,,,,,,,,,,,,,,,,,,,,,,,,,,,,,,,,,,,,,,,,,,,,,2744524,,,,,,,,,,,,,,,,,,,,,,,,,,,,,,,,,,,,,,,
"RODRIGUEZ VAZQUEZ AUDITORES CONSULTORES SC",,,,,,,,,,,,,,,,,,,,,,,,,,,,,,,,,,,,,,,,,,,,,,,,,,,,,,,,41379,,,,,,,,,,,,,,,,,,,,,,,,,,,,,,,,,,,,,,,
"COMPAÑÍA CONSTRUCTORA E INMOBILIARIA KALTEC, S.A. DE C.V.",,,,,,,,,,,,,,,,,,,,,,,,,,,,,,,,,,,,,,,,,,,,,,,,,,,,,,,,4917274,,,,,,,,,,,,,,,,,,,,,,,,,,,,,,,,,,,,,,,
"ARMOR LIFE LAB SA DE CV",ALL141128TY0,,,,,,,,,,,,,,,,,,,,,,,,,,,,,,,,,,,,,,,,,,,,,,,,,,,,,,,3577875,,,,,,,,,,,,,,,,,,,,,,,,,,,,,,,,,,,,,,,
"MAYARK CONSTRUCTORA S DE RL DE CV",MCO160817MC9,,,,,,,,,,,,,,,,,,,,,,,,,,,,,,,,,,,,,,,,,,,,,,,,,,,,,,,232604,,,,,,,,,,,,,,,,,,,,,,,,,,,,,,,,,,,,,,,
"PROVEEDOR DE OFICINAS XINANTECATL SA DE CV",,,,,,,,,,,,,,,,,,,,,,,,,,,,,,,,,,,,,,,,,,,,,,,,,,,,,,,,39852,,,,,,,,,,,,,,,,,,,,,,,,,,,,,,,,,,,,,,,
"GRUPO CAMMINARE SA DE CV",GCA150513TC7,,,,,,,,,,,,,,,,,,,,,,,,,,,,,,,,,,,,,,,,,,,,,,,,,,,,,,,109296,,,,,,,,,,,,,,,,,,,,,,,,,,,,,,,,,,,,,,,
